[
  {
    "id": "17-12-2025-ayrilma-karari-1",
    "date": "2025-12-17",
    "dateDisplay": "17.12.2025",
    "filmTitle": "Ayrılma Kararı",
    "time": "Farklı Saatler",
    "venue": "Farklı Mekanlar",
    "venueId": "various",
    "eventSeries": "Başka Çarşamba",
    "link": "https://www.baskasinema.com/filmler/decision-to-leave/",
    "director": "Park Chan-wook",
    "year": 2022,
    "runtime": 138,
    "programmersNote": "Park Chan-wook'un Cannes'da En İyi Yönetmen ödülü kazanan neo-noir başyapıtı. Bir dedektifin cinayet şüphelisine olan takıntılı aşkını anlatan film, yönetmenin en olgun ve duygusal çalışması olarak öne çıkıyor.",
    "programmersNoteEn": "Park Chan-wook's neo-noir masterpiece that won Best Director at Cannes. The film tells the story of a detective's obsessive love for a murder suspect, standing out as the director's most mature and emotional work."
  },
  {
    "id": "16-12-2025-zama-2",
    "date": "2025-12-16",
    "dateDisplay": "16.12.2025",
    "filmTitle": "Zama",
    "time": "20:00",
    "venue": "Sinematek",
    "venueId": "sinematek",
    "eventSeries": "Rüya Çıkmazı",
    "link": "https://sinematek.kadikoy.bel.tr/Program/Detay?slug=zama-25-09-2025",
    "director": "Lucrecia Martel",
    "year": 2017,
    "runtime": 115,
    "programmersNote": "Lucrecia Martel'in 9 yıllık sessizliğinin ardından çektiği başyapıt. 18. yüzyıl Güney Amerika'sında bir İspanyol yargıcın sömürgecilik eleştirisiyle örülmüş bekleyişini anlatan film, zamanın durduğu bir karabasan.",
    "programmersNoteEn": "A masterpiece from Lucrecia Martel after a 9-year silence. Set in 18th-century South America, the film tells the story of a Spanish magistrate's wait, interwoven with a critique of colonialism—a nightmare where time stands still."
  },
  {
    "id": "16-12-2025-ihtimamin-halleri-kisalar-3",
    "date": "2025-12-16",
    "dateDisplay": "16.12.2025",
    "filmTitle": "İhtimamın Hâlleri Kısalar",
    "time": "19:00",
    "venue": "SALT Beyoğlu",
    "venueId": "salt-beyoglu",
    "eventSeries": "İhtimamın Hâlleri",
    "link": "https://saltonline.org/tr/2963/htimamn-hlleri-ksalar?agenda",
    "programmersNote": "SALT'ın özenle hazırladığı kısa film seçkisi, bakım ve ihtimam kavramlarını farklı perspektiflerden ele alan çalışmaları bir araya getiriyor.",
    "programmersNoteEn": "A carefully curated short film selection by SALT, bringing together works that explore the concepts of care and attention from different perspectives."
  },
  {
    "id": "16-12-2025-tutku-4",
    "date": "2025-12-16",
    "dateDisplay": "16.12.2025",
    "filmTitle": "Tutku - İsyan ve Teslimiyet Arasında",
    "time": "16:00",
    "venue": "Beyoğlu Sineması",
    "venueId": "beyoglu-sinemasi",
    "eventSeries": "BİFED",
    "link": "https://www.instagram.com/stories/highlights/17938093407073436/?hl=en"
  },
  {
    "id": "16-12-2025-andala-5",
    "date": "2025-12-16",
    "dateDisplay": "16.12.2025",
    "filmTitle": "Andala - Son Ziyaret",
    "time": "19:00",
    "venue": "Beyoğlu Sineması",
    "venueId": "beyoglu-sinemasi",
    "eventSeries": "Salı Belgeselleri",
    "link": "https://www.instagram.com/stories/highlights/17938093407073436/?hl=en"
  },
  {
    "id": "16-12-2025-gercek-otesi-6",
    "date": "2025-12-16",
    "dateDisplay": "16.12.2025",
    "filmTitle": "Gerçek Ötesi",
    "time": "21:00",
    "venue": "CKM",
    "venueId": "ckm",
    "link": "https://biletinial.com/tr-tr/sinema/gercek-otesi#"
  },
  {
    "id": "16-12-2025-mavi-ay-7",
    "date": "2025-12-16",
    "dateDisplay": "16.12.2025",
    "filmTitle": "Mavi Ay",
    "time": "21:30",
    "venue": "CKM",
    "venueId": "ckm",
    "link": "https://biletinial.com/tr-tr/sinema/mavi-ay-2025#"
  },
  {
    "id": "17-12-2025-seva-8",
    "date": "2025-12-17",
    "dateDisplay": "17.12.2025",
    "filmTitle": "Seva",
    "time": "19:00",
    "venue": "Postane",
    "venueId": "postane",
    "eventSeries": "Yönetmen Nesime Karateke ile söyleşi",
    "link": "https://www.instagram.com/p/DSAXyHbjRBm/?hl=en",
    "programmersNote": "Gösterim sonrası yönetmen Nesime Karateke ile söyleşi yapılacak. Kaçırmayın!",
    "programmersNoteEn": "Q&A with director Nesime Karateke after the screening. Don't miss it!"
  },
  {
    "id": "17-12-2025-gelecek-9",
    "date": "2025-12-17",
    "dateDisplay": "17.12.2025",
    "filmTitle": "Gelecek",
    "time": "20:00",
    "venue": "Sinematek",
    "venueId": "sinematek",
    "eventSeries": "Alice Rohrwacher Retrospektifi",
    "link": "https://sinematek.kadikoy.bel.tr/Program/Detay?slug=gelecek-futura-25-09-2025",
    "director": "Alice Rohrwacher",
    "year": 2021,
    "runtime": 105,
    "programmersNote": "Alice Rohrwacher'ın kısa belgeseli, pandemi döneminde İtalya'nın farklı bölgelerinden gençlerin gelecek hayallerini sorguluyor. Yönetmenin retrospektifinin önemli bir parçası.",
    "programmersNoteEn": "Alice Rohrwacher's short documentary questions the future dreams of young people from different regions of Italy during the pandemic. An important part of the director's retrospective."
  },
  {
    "id": "17-12-2025-paris-uyuyor-10",
    "date": "2025-12-17",
    "dateDisplay": "17.12.2025",
    "filmTitle": "Paris Uyuyor",
    "time": "19:00",
    "venue": "Beyoğlu Sineması",
    "venueId": "beyoglu-sinemasi",
    "eventSeries": "SİNEKONSER",
    "link": "https://www.instagram.com/stories/highlights/17938093407073436/?hl=en",
    "director": "René Clair",
    "year": 1924,
    "runtime": 61,
    "programmersNote": "René Clair'in 1924 yapımı sessiz filmi canlı müzik eşliğinde! Sinekonserlerin kaçırılmaması gereken bir gecesi.",
    "programmersNoteEn": "René Clair's 1924 silent film accompanied by live music! An unmissable night of cine-concert programming."
  },
  {
    "id": "17-12-2025-satici-11",
    "date": "2025-12-17",
    "dateDisplay": "17.12.2025",
    "filmTitle": "Satıcı",
    "time": "19:30",
    "venue": "Atlas 1948",
    "venueId": "atlas-1948",
    "link": "https://www.instagram.com/p/DSCiuzgjPyw/?img_index=1",
    "director": "Asghar Farhadi",
    "year": 2016,
    "runtime": 124,
    "programmersNote": "Asghar Farhadi'nin Oscar kazanan başyapıtı. Tahran'da bir tiyatro oyuncusu çiftin hayatının karanlık bir olayla sarsılmasını anlatan gerilim dolu dram.",
    "programmersNoteEn": "Asghar Farhadi's Oscar-winning masterpiece. A tension-filled drama about a theatre actor couple in Tehran whose lives are shaken by a dark incident."
  },
  {
    "id": "18-12-2025-paris-uyuyor-12",
    "date": "2025-12-18",
    "dateDisplay": "18.12.2025",
    "filmTitle": "Paris Uyuyor",
    "time": "20:00",
    "venue": "Sinematek",
    "venueId": "sinematek",
    "link": "https://sinematek.kadikoy.bel.tr/Program/Detay?slug=paris-uyuyor-paris-qui-dort-26-09-2025",
    "director": "René Clair",
    "year": 1924,
    "runtime": 61
  },
  {
    "id": "18-12-2025-sanat-akademisi-1994-13",
    "date": "2025-12-18",
    "dateDisplay": "18.12.2025",
    "filmTitle": "Sanat Akademisi 1994",
    "time": "13:00",
    "venue": "İstanbul Modern",
    "venueId": "istanbul-modern",
    "eventSeries": "Hikaye Çin'de Geçiyor",
    "link": "https://www.istanbulmodern.org/film/sanat-akademisi-1994-yi-shu-xue-yuan-1994-2023",
    "director": "Liu Xiaodong",
    "year": 2023,
    "runtime": 80,
    "programmersNote": "İstanbul Modern'in Çin sineması seçkisinden. 1994 yılında Pekin'deki bir sanat akademisinin öğrencilerinin gündelik hayatını takip eden belgesel.",
    "programmersNoteEn": "From Istanbul Modern's Chinese cinema selection. A documentary following the daily lives of students at an art academy in Beijing in 1994."
  },
  {
    "id": "18-12-2025-manti-kralicesi-14",
    "date": "2025-12-18",
    "dateDisplay": "18.12.2025",
    "filmTitle": "Mantı Kraliçesi",
    "time": "15:15",
    "venue": "İstanbul Modern",
    "venueId": "istanbul-modern",
    "eventSeries": "Hikaye Çin'de Geçiyor",
    "link": "https://www.istanbulmodern.org/film/manti-kralicesi-shui-jiao-huang-hou-2025",
    "director": "Zhang Zining",
    "year": 2024,
    "runtime": 90
  },
  {
    "id": "18-12-2025-golgesiz-kule-15",
    "date": "2025-12-18",
    "dateDisplay": "18.12.2025",
    "filmTitle": "Gölgesiz Kule",
    "time": "17:30",
    "venue": "İstanbul Modern",
    "venueId": "istanbul-modern",
    "eventSeries": "Hikaye Çin'de Geçiyor",
    "link": "https://www.istanbulmodern.org/film/golgesiz-kule-bai-ta-zhi-guang-2023",
    "director": "Zhang Lu",
    "year": 2023,
    "runtime": 144
  },
  {
    "id": "18-12-2025-oyle-sevdim-ki-seni-16",
    "date": "2025-12-18",
    "dateDisplay": "18.12.2025",
    "filmTitle": "Öyle Sevdim ki Seni",
    "time": "19:00",
    "venue": "Beyoğlu Sineması",
    "venueId": "beyoglu-sinemasi",
    "eventSeries": "Uzak Olmayan Bir Geçmişten",
    "link": "https://www.instagram.com/stories/highlights/17938093407073436/?hl=en"
  },
  {
    "id": "18-12-2025-inland-empire-17",
    "date": "2025-12-18",
    "dateDisplay": "18.12.2025",
    "filmTitle": "Inland Empire",
    "time": "19:30",
    "venue": "Atlas 1948",
    "venueId": "atlas-1948",
    "link": "https://biletinial.com/tr-tr/sinema/indland-empire-2006#",
    "director": "David Lynch",
    "year": 2006,
    "runtime": 180,
    "programmersNote": "David Lynch'in 3 saatlik deneysel başyapıtı. Dijital kamerayla çekilen film, Hollywood'un karanlık dehlizlerinde kaybolan bir aktrisin kabusvari yolculuğu. Lynch hayranları için kaçırılmaz.",
    "programmersNoteEn": "David Lynch's 3-hour experimental masterpiece. Shot on digital camera, the film follows an actress's nightmarish journey through Hollywood's dark corridors. Unmissable for Lynch fans."
  },
  {
    "id": "18-12-2025-icimdeki-deniz-18",
    "date": "2025-12-18",
    "dateDisplay": "18.12.2025",
    "filmTitle": "İçimdeki Deniz",
    "time": "Farklı Saatler",
    "venue": "Farklı Mekanlar",
    "venueId": "various",
    "eventSeries": "Unutulmaz Perşembe",
    "link": "https://www.instagram.com/p/DSFEslRjKN2/?img_index=1",
    "director": "Alejandro Amenábar",
    "year": 2004,
    "runtime": 126
  },
  {
    "id": "19-12-2025-dalloway-19",
    "date": "2025-12-19",
    "dateDisplay": "19.12.2025",
    "filmTitle": "Dalloway",
    "time": "19:00",
    "venue": "Fransız Kültür",
    "venueId": "fransiz-kultur",
    "eventSeries": "Kasım-Aralık Sinema Programı",
    "link": "https://www.ifturquie.org/etkinlik/sinema-dalloway/",
    "director": "Marleen Gorris",
    "year": 1997,
    "runtime": 97
  },
  {
    "id": "19-12-2025-olumsuz-kadin-20",
    "date": "2025-12-19",
    "dateDisplay": "19.12.2025",
    "filmTitle": "Ölümsüz Kadın",
    "time": "20:00",
    "venue": "Sinematek",
    "venueId": "sinematek",
    "eventSeries": "Rüya Çıkmazı",
    "link": "https://sinematek.kadikoy.bel.tr/Program/Detay?slug=olumsuz-kadin-l-immortelle-25-09-2025",
    "director": "Alain Robbe-Grillet",
    "year": 1963,
    "runtime": 101,
    "programmersNote": "Alain Robbe-Grillet'nin yönetmenlik çıkışı. Nouveau roman akımının sinemadaki yansıması olan bu gizemli film, İstanbul sokaklarında geçen büyüleyici bir aşk hikayesi.",
    "programmersNoteEn": "Alain Robbe-Grillet's directorial debut. This mysterious film, a cinematic reflection of the nouveau roman movement, is a captivating love story set in the streets of Istanbul."
  },
  {
    "id": "19-12-2025-ihtimamin-halleri-experimental-21",
    "date": "2025-12-19",
    "dateDisplay": "19.12.2025",
    "filmTitle": "İhtimamın Hâlleri Kısalar - İstanbul Experimental iş birliğiyle",
    "time": "19:00",
    "venue": "SALT Beyoğlu",
    "venueId": "salt-beyoglu",
    "eventSeries": "İhtimamın Hâlleri",
    "link": "https://saltonline.org/tr/2965/htimamn-hlleri-ksalar?agenda",
    "programmersNote": "İstanbul Experimental ile ortak program. Deneysel kısa filmler aracılığıyla bakım ve ihtimam kavramlarının sorgulandığı özel bir gece.",
    "programmersNoteEn": "Joint program with Istanbul Experimental. A special evening exploring concepts of care and attention through experimental short films."
  },
  {
    "id": "20-12-2025-onlardan-sonra-gelen-cocuklar-22",
    "date": "2025-12-20",
    "dateDisplay": "20.12.2025",
    "filmTitle": "Onlardan Sonra Gelen Çocuklar",
    "time": "19:00",
    "venue": "Fransız Kültür",
    "venueId": "fransiz-kultur",
    "eventSeries": "Kasım-Aralık Sinema Programı",
    "link": "https://www.ifturquie.org/etkinlik/sinema-leurs-enfants-apres-eux/",
    "director": "Ludovic & Zoran Boukherma",
    "year": 2024,
    "runtime": 142
  },
  {
    "id": "20-12-2025-kucuk-ulke-23",
    "date": "2025-12-20",
    "dateDisplay": "20.12.2025",
    "filmTitle": "Küçük Ülke",
    "time": "16:00",
    "venue": "Fransız Kültür",
    "venueId": "fransiz-kultur",
    "eventSeries": "Kasım-Aralık Sinema Programı",
    "link": "https://www.ifturquie.org/etkinlik/sinema-petit-pays/",
    "director": "Eric Barbier",
    "year": 2020,
    "runtime": 111
  },
  {
    "id": "20-12-2025-gec-saatler-24",
    "date": "2025-12-20",
    "dateDisplay": "20.12.2025",
    "filmTitle": "Geç Saatler",
    "time": "14:00",
    "venue": "Sinematek",
    "venueId": "sinematek",
    "eventSeries": "Rüya Çıkmazı",
    "link": "https://sinematek.kadikoy.bel.tr/Program/Detay?slug=gec-saatler-after-hours-25-09-2025",
    "director": "Martin Scorsese",
    "year": 1985,
    "runtime": 97,
    "programmersNote": "Martin Scorsese'nin kara komedi başyapıtı. Manhattan'ın gecesinde kaybolan bir adamın absürt macerası. Scorsese'nin en az bilinen ama en eğlenceli filmlerinden.",
    "programmersNoteEn": "Martin Scorsese's dark comedy masterpiece. The absurd adventure of a man lost in the Manhattan night. One of Scorsese's least known but most entertaining films."
  },
  {
    "id": "20-12-2025-hirsiz-25",
    "date": "2025-12-20",
    "dateDisplay": "20.12.2025",
    "filmTitle": "Hırsız",
    "time": "18:30",
    "venue": "Sinematek",
    "venueId": "sinematek",
    "eventSeries": "Il Cinema Ritrovato Seçkisi",
    "link": "https://sinematek.kadikoy.bel.tr/Program/Detay?slug=hirsiz-thief-25-09-2025",
    "director": "Michael Mann",
    "year": 1981,
    "runtime": 123,
    "programmersNote": "Michael Mann'in ilk uzun metrajlı filmi. James Caan'ın unutulmaz performansıyla, profesyonel bir hırsızın son işini anlatan neo-noir şaheseri.",
    "programmersNoteEn": "Michael Mann's first feature film. A neo-noir masterpiece about a professional thief's last job, featuring James Caan's unforgettable performance."
  },
  {
    "id": "20-12-2025-sato-26",
    "date": "2025-12-20",
    "dateDisplay": "20.12.2025",
    "filmTitle": "Şato",
    "time": "16:30",
    "venue": "SALT Beyoğlu",
    "venueId": "salt-beyoglu",
    "eventSeries": "İhtimamın Hâlleri",
    "link": "https://saltonline.org/tr/2966/htimamn-hlleri-le-chteau-ato?agenda"
  },
  {
    "id": "20-12-2025-annemin-ardindan-27",
    "date": "2025-12-20",
    "dateDisplay": "20.12.2025",
    "filmTitle": "Annemin Ardından",
    "time": "18:00",
    "venue": "SALT Beyoğlu",
    "venueId": "salt-beyoglu",
    "eventSeries": "İhtimamın Hâlleri",
    "link": "https://saltonline.org/tr/2967/htimamn-hlleri-jai-plac-ma-mre-annemin-ardndan?agenda"
  },
  {
    "id": "20-12-2025-onun-hikayesi-28",
    "date": "2025-12-20",
    "dateDisplay": "20.12.2025",
    "filmTitle": "Onun Hikâyesi",
    "time": "13:00",
    "venue": "İstanbul Modern",
    "venueId": "istanbul-modern",
    "eventSeries": "Hikaye Çin'de Geçiyor",
    "link": "https://www.istanbulmodern.org/film/onun-hikayesi-hao-dong-xi-2024"
  },
  {
    "id": "20-12-2025-manti-kralicesi-29",
    "date": "2025-12-20",
    "dateDisplay": "20.12.2025",
    "filmTitle": "Mantı Kraliçesi",
    "time": "15:15",
    "venue": "İstanbul Modern",
    "venueId": "istanbul-modern",
    "eventSeries": "Hikaye Çin'de Geçiyor",
    "link": "https://www.istanbulmodern.org/film/manti-kralicesi-shui-jiao-huang-hou-2025",
    "director": "Zhang Zining",
    "year": 2024,
    "runtime": 90
  },
  {
    "id": "20-12-2025-lisbon-maru-30",
    "date": "2025-12-20",
    "dateDisplay": "20.12.2025",
    "filmTitle": "Lisbon Maru'nun Batışı",
    "time": "17:30",
    "venue": "İstanbul Modern",
    "venueId": "istanbul-modern",
    "eventSeries": "Hikaye Çin'de Geçiyor",
    "link": "https://www.istanbulmodern.org/film/lisbon-maru-nun-batisi-li-si-ben-wan-chen-mo-2023",
    "director": "Fang Li",
    "year": 2023,
    "runtime": 122
  },
  {
    "id": "21-12-2025-barry-lyndon-31",
    "date": "2025-12-21",
    "dateDisplay": "21.12.2025",
    "filmTitle": "Barry Lyndon",
    "time": "14:00",
    "venue": "Sinematek",
    "venueId": "sinematek",
    "eventSeries": "Il Cinema Ritrovato Seçkisi",
    "link": "https://sinematek.kadikoy.bel.tr/Program/Detay?slug=barry-lyndon-25-09-2025",
    "director": "Stanley Kubrick",
    "year": 1975,
    "runtime": 185,
    "programmersNote": "Stanley Kubrick'in görsel şöleni. Doğal ışıkla çekilen 18. yüzyıl destanı, sinema tarihinin en güzel görüntülerine sahip filmlerden biri. Büyük perdede izleme fırsatını kaçırmayın.",
    "programmersNoteEn": "Stanley Kubrick's visual feast. Shot with natural light, this 18th-century epic features some of cinema history's most beautiful imagery. Don't miss the chance to see it on the big screen."
  },
  {
    "id": "21-12-2025-mogolistanli-jean-darc-32",
    "date": "2025-12-21",
    "dateDisplay": "21.12.2025",
    "filmTitle": "Moğolistanlı Jean D'Arc",
    "time": "18:30",
    "venue": "Sinematek",
    "venueId": "sinematek",
    "eventSeries": "Ulrike Ottinger Seçkisi",
    "link": "https://sinematek.kadikoy.bel.tr/Program/Detay?slug=kayip-otoban-lost-highway-25-09-2025",
    "director": "Ulrike Ottinger",
    "year": 1989,
    "runtime": 265,
    "programmersNote": "Ulrike Ottinger'in Moğolistan'da çektiği destansı belgesel. Şamanizm, göçebe kültürü ve modern yaşamın kesişim noktalarını keşfeden görsel bir yolculuk.",
    "programmersNoteEn": "Ulrike Ottinger's epic documentary shot in Mongolia. A visual journey exploring the intersection of shamanism, nomadic culture, and modern life."
  },
  {
    "id": "21-12-2025-sanat-akademisi-1994-33",
    "date": "2025-12-21",
    "dateDisplay": "21.12.2025",
    "filmTitle": "Sanat Akademisi 1994",
    "time": "14:00",
    "venue": "İstanbul Modern",
    "venueId": "istanbul-modern",
    "eventSeries": "Hikaye Çin'de Geçiyor",
    "link": "https://www.istanbulmodern.org/film/sanat-akademisi-1994-yi-shu-xue-yuan-1994-2023",
    "director": "Liu Xiaodong",
    "year": 2023,
    "runtime": 80
  },
  {
    "id": "21-12-2025-golgesiz-kule-34",
    "date": "2025-12-21",
    "dateDisplay": "21.12.2025",
    "filmTitle": "Gölgesiz Kule",
    "time": "16:30",
    "venue": "İstanbul Modern",
    "venueId": "istanbul-modern",
    "eventSeries": "Hikaye Çin'de Geçiyor",
    "link": "https://www.istanbulmodern.org/film/golgesiz-kule-bai-ta-zhi-guang-2023",
    "director": "Zhang Lu",
    "year": 2023,
    "runtime": 144
  },
  {
    "id": "21-12-2025-grinc-35",
    "date": "2025-12-21",
    "dateDisplay": "21.12.2025",
    "filmTitle": "Grinç",
    "time": "13:00",
    "venue": "Beyoğlu Sineması",
    "venueId": "beyoglu-sinemasi",
    "eventSeries": "Çocuk Matinesi",
    "link": "https://www.instagram.com/stories/highlights/17938093407073436/?hl=en",
    "director": "Ron Howard",
    "year": 2000,
    "runtime": 104
  },
  {
    "id": "21-12-2025-existenz-36",
    "date": "2025-12-21",
    "dateDisplay": "21.12.2025",
    "filmTitle": "eXistenZ",
    "time": "15:00",
    "venue": "Beyoğlu Sineması",
    "venueId": "beyoglu-sinemasi",
    "eventSeries": "Sinema Seminerleri",
    "link": "https://www.instagram.com/stories/highlights/17938093407073436/?hl=en",
    "director": "David Cronenberg",
    "year": 1999,
    "runtime": 97,
    "programmersNote": "David Cronenberg'in beden korkusu (body horror) estetiğini sanal gerçeklikle buluşturduğu kült film. Oyun mu gerçek mi? Sınırlar belirsizleşiyor.",
    "programmersNoteEn": "David Cronenberg's cult film that merges body horror aesthetics with virtual reality. Is it a game or reality? The boundaries blur."
  },
  {
    "id": "21-12-2025-hakki-37",
    "date": "2025-12-21",
    "dateDisplay": "21.12.2025",
    "filmTitle": "Hakkı",
    "time": "19:00",
    "venue": "Beyoğlu Sineması",
    "venueId": "beyoglu-sinemasi",
    "eventSeries": "5. Sinemada Festivali Seçkisi",
    "link": "https://www.instagram.com/stories/highlights/17938093407073436/?hl=en"
  },
  {
    "id": "23-12-2025-paris-caligrammes-38",
    "date": "2025-12-23",
    "dateDisplay": "23.12.2025",
    "filmTitle": "Paris Caligrammes",
    "time": "20:00",
    "venue": "Sinematek",
    "venueId": "sinematek",
    "eventSeries": "Ulrike Ottinger Seçkisi",
    "link": "https://sinematek.kadikoy.bel.tr/Program/Detay?slug=paris-calligrammes-10-10-2025",
    "director": "Ulrike Ottinger",
    "year": 2020,
    "runtime": 129
  },
  {
    "id": "23-12-2025-bir-sans-daha-39",
    "date": "2025-12-23",
    "dateDisplay": "23.12.2025",
    "filmTitle": "Bir Şans Daha",
    "time": "16:00",
    "venue": "Beyoğlu Sineması",
    "venueId": "beyoglu-sinemasi",
    "eventSeries": "Üzümden Önce Mısırını Ye!",
    "link": "https://www.instagram.com/stories/highlights/17938093407073436/?hl=en"
  },
  {
    "id": "23-12-2025-firatin-tutsagi-40",
    "date": "2025-12-23",
    "dateDisplay": "23.12.2025",
    "filmTitle": "Fırat'ın Tutsağı ve Son Tuzak",
    "time": "19:00",
    "venue": "Beyoğlu Sineması",
    "venueId": "beyoglu-sinemasi",
    "eventSeries": "Salı Belgeselleri",
    "link": "https://www.instagram.com/stories/highlights/17938093407073436/?hl=en"
  },
  {
    "id": "23-12-2025-teoman-madra-41",
    "date": "2025-12-23",
    "dateDisplay": "23.12.2025",
    "filmTitle": "Konuşma ve Performans: Teoman Madra'nın Ardından",
    "time": "19:00",
    "venue": "SALT Beyoğlu",
    "venueId": "salt-beyoglu",
    "link": "https://saltonline.org/tr/2979/konuma-ve-performans-teoman-madrann-ardndan?agenda"
  },
  {
    "id": "23-12-2025-dus-halleri-42",
    "date": "2025-12-23",
    "dateDisplay": "23.12.2025",
    "filmTitle": "Uluslararası Sanatçı Filmleri: Düş Hâlleri",
    "time": "",
    "venue": "İstanbul Modern",
    "venueId": "istanbul-modern",
    "eventSeries": "Uluslararası Sanatçı Filmleri",
    "link": "https://www.istanbulmodern.org/etkinlikler/uluslararasi-sanatci-filmleri-2025"
  },
  {
    "id": "24-12-2025-ask-43",
    "date": "2025-12-24",
    "dateDisplay": "24.12.2025",
    "filmTitle": "Aşk",
    "time": "Farklı Saatler",
    "venue": "Farklı Mekanlar",
    "venueId": "various",
    "eventSeries": "Başka Çarşamba",
    "link": "https://www.baskasinema.com/filmler/amour/",
    "director": "Michael Haneke",
    "year": 2012,
    "runtime": 127
  },
  {
    "id": "24-12-2025-kimera-44",
    "date": "2025-12-24",
    "dateDisplay": "24.12.2025",
    "filmTitle": "Kimera",
    "time": "20:00",
    "venue": "Sinematek",
    "venueId": "sinematek",
    "eventSeries": "Alice Rohrwacher Retrospektifi",
    "link": "https://sinematek.kadikoy.bel.tr/Program/Detay?slug=kimera-la-chimera-25-09-2025",
    "director": "Alice Rohrwacher",
    "year": 2023,
    "runtime": 130
  },
  {
    "id": "24-12-2025-maddenin-halleri-45",
    "date": "2025-12-24",
    "dateDisplay": "24.12.2025",
    "filmTitle": "Maddenin Halleri",
    "time": "19:00",
    "venue": "Beyoğlu Sineması",
    "venueId": "beyoglu-sinemasi",
    "eventSeries": "Yakın Dönem Bağımsızlar",
    "link": "https://www.instagram.com/stories/highlights/17938093407073436/?hl=en"
  },
  {
    "id": "24-12-2025-kus-bakisi-46",
    "date": "2025-12-24",
    "dateDisplay": "24.12.2025",
    "filmTitle": "Kuş Bakışı: Sömürgecilik ve Altyapı Üzerine Bir Gösterim ve Konuşma",
    "time": "18:00",
    "venue": "Depo İstanbul",
    "venueId": "depo-istanbul",
    "link": "https://www.depoistanbul.net/kus-bakisi-somurgecilik-ve-altyapi-uzerine-bir-gosterim-ve-konusma/"
  },
  {
    "id": "24-12-2025-amadeus-47",
    "date": "2025-12-24",
    "dateDisplay": "24.12.2025",
    "filmTitle": "Amadeus",
    "time": "19:00",
    "venue": "Pera Müzesi",
    "venueId": "pera-muzesi",
    "eventSeries": "Bütün O Sanat",
    "link": "https://www.peramuzesi.org.tr/film/amadeus-/5828/3558",
    "director": "Miloš Forman",
    "year": 1984,
    "runtime": 160
  },
  {
    "id": "24-12-2025-gunes-sonrasi-48",
    "date": "2025-12-24",
    "dateDisplay": "24.12.2025",
    "filmTitle": "Güneş Sonrası",
    "time": "12:45",
    "venue": "Kadıköy Sineması",
    "venueId": "kadikoy-sinemasi",
    "link": "https://biletinial.com/tr-tr/sinema/gunes-sonrasi#",
    "director": "Charlotte Wells",
    "year": 2022,
    "runtime": 102
  },
  {
    "id": "25-12-2025-drakula-istanbulda-49",
    "date": "2025-12-25",
    "dateDisplay": "25.12.2025",
    "filmTitle": "Drakula İstanbul'da",
    "time": "20:00",
    "venue": "Sinematek",
    "venueId": "sinematek",
    "eventSeries": "Yeniden: Sinematek Restorasyon",
    "link": "https://sinematek.kadikoy.bel.tr/Program/Detay?slug=drakula-istanbulda-12-11-2025",
    "director": "Mehmet Muhtar",
    "year": 1953,
    "runtime": 109
  },
  {
    "id": "25-12-2025-bridget-jones-50",
    "date": "2025-12-25",
    "dateDisplay": "25.12.2025",
    "filmTitle": "Bridget Jones",
    "time": "16:00",
    "venue": "Beyoğlu Sineması",
    "venueId": "beyoglu-sinemasi",
    "eventSeries": "Üzümden Önce Mısırını Ye!",
    "link": "https://www.instagram.com/stories/highlights/17938093407073436/?hl=en",
    "director": "Sharon Maguire",
    "year": 2001,
    "runtime": 97
  },
  {
    "id": "25-12-2025-uzgunum-bebegim-51",
    "date": "2025-12-25",
    "dateDisplay": "25.12.2025",
    "filmTitle": "Üzgünüm, Bebeğim",
    "time": "14:30",
    "venue": "Atlas 1948",
    "venueId": "atlas-1948",
    "link": "https://www.instagram.com/p/DSPT3cZDCKf/?img_index=1"
  },
  {
    "id": "26-12-2025-sans-soleil-52",
    "date": "2025-12-26",
    "dateDisplay": "26.12.2025",
    "filmTitle": "Sans soleil",
    "time": "20:00",
    "venue": "Atlas 1948",
    "venueId": "atlas-1948",
    "eventSeries": "Othon Cinema",
    "link": "https://othoncinema.com/2025/12/05/sans-soleil-gosterimi/",
    "director": "Chris Marker",
    "year": 1983,
    "runtime": 100
  },
  {
    "id": "26-12-2025-ucuncu-turden-yakinlasmalar-53",
    "date": "2025-12-26",
    "dateDisplay": "26.12.2025",
    "filmTitle": "Üçüncü Türden Yakınlaşmalar",
    "time": "20:00",
    "venue": "Sinematek",
    "venueId": "sinematek",
    "eventSeries": "Il Cinema Ritrovato Seçkisi",
    "link": "https://sinematek.kadikoy.bel.tr/Program/Detay?slug=ucuncu-turden-yakinlasmalar-close-encounters-of-the-third-kind-25-09-2025",
    "director": "Steven Spielberg",
    "year": 1977,
    "runtime": 135
  },
  {
    "id": "26-12-2025-hayatin-tum-acilari-54",
    "date": "2025-12-26",
    "dateDisplay": "26.12.2025",
    "filmTitle": "Hayatın Tüm Acıları ve Güzellikleri",
    "time": "19:00",
    "venue": "Pera Müzesi",
    "venueId": "pera-muzesi",
    "eventSeries": "Bütün O Sanat",
    "link": "https://www.peramuzesi.org.tr/film/hayatin-tum-acilari-ve-guzellikleri-/5825/3558",
    "director": "Laura Poitras",
    "year": 2022,
    "runtime": 117
  },
  {
    "id": "26-12-2025-dus-halleri-55",
    "date": "2025-12-26",
    "dateDisplay": "26.12.2025",
    "filmTitle": "Uluslararası Sanatçı Filmleri: Düş Hâlleri",
    "time": "",
    "venue": "İstanbul Modern",
    "venueId": "istanbul-modern",
    "eventSeries": "Uluslararası Sanatçı Filmleri",
    "link": "https://www.istanbulmodern.org/etkinlikler/uluslararasi-sanatci-filmleri-2025"
  },
  {
    "id": "26-12-2025-uzgunum-bebegim-56",
    "date": "2025-12-26",
    "dateDisplay": "26.12.2025",
    "filmTitle": "Üzgünüm, Bebeğim",
    "time": "14:30",
    "venue": "Atlas 1948",
    "venueId": "atlas-1948",
    "link": "https://www.instagram.com/p/DSPT3cZDCKf/?img_index=1"
  },
  {
    "id": "26-12-2025-dehsetin-gecesi-57",
    "date": "2025-12-26",
    "dateDisplay": "26.12.2025",
    "filmTitle": "Dehşetin Gecesi 5 Yılbaşı Özel",
    "time": "23:59",
    "venue": "Torun Center",
    "venueId": "torun-center",
    "link": "https://biletinial.com/tr-tr/sinema/dehsetin-gecesi-5-yilbasi-ozel#",
    "synopsis": "Silent Night, Bloody Night (1972), The City of the Dead (1960), Dementia 13 (1963), The Stranger (1946)"
  },
  {
    "id": "27-12-2025-kiyamet-son-kurgu-58",
    "date": "2025-12-27",
    "dateDisplay": "27.12.2025",
    "filmTitle": "Kıyamet: Son Kurgu",
    "time": "14:00",
    "venue": "Sinematek",
    "venueId": "sinematek",
    "eventSeries": "Rüya Çıkmazı",
    "link": "https://sinematek.kadikoy.bel.tr/Program/Detay?slug=kiyamet-son-kurgu-apocalypse-now-final-cut-25-09-2025",
    "director": "Francis Ford Coppola",
    "year": 1979,
    "runtime": 183
  },
  {
    "id": "27-12-2025-dehsetin-nefesi-59",
    "date": "2025-12-27",
    "dateDisplay": "27.12.2025",
    "filmTitle": "Dehşetin Nefesi",
    "time": "18:30",
    "venue": "Sinematek",
    "venueId": "sinematek",
    "eventSeries": "Rüya Çıkmazı",
    "link": "https://sinematek.kadikoy.bel.tr/Program/Detay?slug=dehsetin-nefesi-jacobs-ladder-25-09-2025",
    "director": "Adrian Lyne",
    "year": 1990,
    "runtime": 113
  },
  {
    "id": "27-12-2025-beyaz-noel-60",
    "date": "2025-12-27",
    "dateDisplay": "27.12.2025",
    "filmTitle": "Beyaz Noel",
    "time": "14:00",
    "venue": "Beykoz Kundura",
    "venueId": "beykoz-kundura",
    "eventSeries": "Yılbaşı Restore Klasikleri",
    "link": "https://beykozkundura.com/event/kundura-klasikleri-yilbasi-ozel/",
    "director": "Michael Curtiz",
    "year": 1954,
    "runtime": 120
  },
  {
    "id": "27-12-2025-sahane-hayat-61",
    "date": "2025-12-27",
    "dateDisplay": "27.12.2025",
    "filmTitle": "Şahane Hayat",
    "time": "17:30",
    "venue": "Beykoz Kundura",
    "venueId": "beykoz-kundura",
    "eventSeries": "Yılbaşı Restore Klasikleri",
    "link": "https://beykozkundura.com/event/kundura-klasikleri-yilbasi-ozel/",
    "director": "Frank Capra",
    "year": 1946,
    "runtime": 130
  },
  {
    "id": "27-12-2025-nefret-62",
    "date": "2025-12-27",
    "dateDisplay": "27.12.2025",
    "filmTitle": "Nefret",
    "time": "15:00",
    "venue": "Pera Müzesi",
    "venueId": "pera-muzesi",
    "eventSeries": "Bütün O Sanat",
    "link": "https://www.peramuzesi.org.tr/film/nefret-/5833/3558",
    "director": "Mathieu Kassovitz",
    "year": 1995,
    "runtime": 98
  },
  {
    "id": "27-12-2025-uzgunum-bebegim-63",
    "date": "2025-12-27",
    "dateDisplay": "27.12.2025",
    "filmTitle": "Üzgünüm, Bebeğim",
    "time": "14:30",
    "venue": "Atlas 1948",
    "venueId": "atlas-1948",
    "link": "https://www.instagram.com/p/DSPT3cZDCKf/?img_index=1"
  },
  {
    "id": "27-12-2025-kaybedenler-kulubu-64",
    "date": "2025-12-27",
    "dateDisplay": "27.12.2025",
    "filmTitle": "Kaybedenler Kulübü: Film & Party",
    "time": "21:00",
    "venue": "Torun Center",
    "venueId": "torun-center",
    "link": "https://biletinial.com/tr-tr/sinema/kaybedenler-kulubu-film-party#",
    "director": "Tolga Örnek",
    "year": 2011,
    "runtime": 115
  },
  {
    "id": "28-12-2025-mutlu-lazzaro-65",
    "date": "2025-12-28",
    "dateDisplay": "28.12.2025",
    "filmTitle": "Mutlu Lazzaro",
    "time": "18:30",
    "venue": "Sinematek",
    "venueId": "sinematek",
    "eventSeries": "Alice Rohrwacher Retrospektifi",
    "link": "https://sinematek.kadikoy.bel.tr/Program/Detay?slug=mutlu-lazzaro-lazzaro-felice-25-09-2025",
    "director": "Alice Rohrwacher",
    "year": 2018,
    "runtime": 125
  },
  {
    "id": "28-12-2025-korkuyla-uyan-66",
    "date": "2025-12-28",
    "dateDisplay": "28.12.2025",
    "filmTitle": "Korkuyla Uyan",
    "time": "14:00",
    "venue": "Sinematek",
    "venueId": "sinematek",
    "eventSeries": "Rüya Çıkmazı",
    "link": "https://sinematek.kadikoy.bel.tr/Program/Detay?slug=korkuyla-uyan-wake-in-fright-25-09-2025",
    "director": "Ted Kotcheff",
    "year": 1971,
    "runtime": 109
  },
  {
    "id": "28-12-2025-close-up-67",
    "date": "2025-12-28",
    "dateDisplay": "28.12.2025",
    "filmTitle": "Close-Up",
    "time": "19:30",
    "venue": "Atlas 1948",
    "venueId": "atlas-1948",
    "link": "https://www.instagram.com/p/DSKuEAXjFSY/?img_index=1",
    "director": "Abbas Kiarostami",
    "year": 1990,
    "runtime": 98
  },
  {
    "id": "22-28-12-2025-35-mayis-68",
    "date": "2025-12-22",
    "dateDisplay": "Bütün Hafta",
    "filmTitle": "35 Mayıs",
    "time": "",
    "venue": "Paribu Art",
    "venueId": "paribu-art",
    "eventSeries": "KREK VR",
    "link": "https://www.instagram.com/p/DSKhvl4DKv6/"
  },
  {
    "id": "01-01-2026-dunyanin-en-kotu-insani-69",
    "date": "2026-01-01",
    "dateDisplay": "01.01.2026",
    "filmTitle": "Dünyanın En Kötü İnsanı",
    "filmTitleEn": "The Worst Person in the World",
    "time": "Farklı Saatler",
    "venue": "Farklı Mekanlar",
    "venueId": "various",
    "eventSeries": "Unutulmaz Perşembe",
    "link": "https://www.instagram.com/p/DSuGWsNCi_b/?hl=en&img_index=3",
    "director": "Joachim Trier",
    "year": 2021,
    "runtime": 128
  },
  {
    "id": "30-12-2025-kayip-otoban-70",
    "date": "2025-12-30",
    "dateDisplay": "30.12.2025",
    "filmTitle": "Kayıp Otoban",
    "filmTitleEn": "Lost Highway",
    "time": "20:00",
    "venue": "Sinematek",
    "venueId": "sinematek",
    "eventSeries": "Rüya Çıkmazı",
    "link": "https://sinematek.kadikoy.bel.tr/Program/Detay?slug=kayip-otoban-lost-highway-25-09-2025",
    "director": "David Lynch",
    "year": 1997,
    "runtime": 134
  },
  {
    "id": "30-12-2025-dus-halleri-71",
    "date": "2025-12-30",
    "dateDisplay": "30.12.2025",
    "filmTitle": "Uluslararası Sanatçı Filmleri: Düş Hâlleri",
    "time": "14:00",
    "venue": "İstanbul Modern",
    "venueId": "istanbul-modern",
    "eventSeries": "Uluslararası Sanatçı Filmleri: Düş Hâlleri",
    "link": "https://www.istanbulmodern.org/etkinlikler/uluslararasi-sanatci-filmleri-2025"
  },
  {
    "id": "02-01-2026-dus-halleri-72",
    "date": "2026-01-02",
    "dateDisplay": "02.01.2026",
    "filmTitle": "Uluslararası Sanatçı Filmleri: Düş Hâlleri",
    "time": "14:00",
    "venue": "İstanbul Modern",
    "venueId": "istanbul-modern",
    "eventSeries": "Uluslararası Sanatçı Filmleri: Düş Hâlleri",
    "link": "https://www.istanbulmodern.org/etkinlikler/uluslararasi-sanatci-filmleri-2025"
  },
  {
    "id": "03-01-2026-pina-73",
    "date": "2026-01-03",
    "dateDisplay": "03.01.2026",
    "filmTitle": "Pina",
    "filmTitleEn": "Pina",
    "time": "15:00",
    "venue": "Pera Müzesi",
    "venueId": "pera-muzesi",
    "eventSeries": "Bütün O Sanat",
    "link": "https://www.peramuzesi.org.tr/film/pina-/5832/3558",
    "director": "Wim Wenders",
    "year": 2011,
    "runtime": 103
  },
  {
    "id": "03-01-2026-barton-fink-74",
    "date": "2026-01-03",
    "dateDisplay": "03.01.2026",
    "filmTitle": "Barton Fink",
    "filmTitleEn": "Barton Fink",
    "time": "17:00",
    "venue": "Pera Müzesi",
    "venueId": "pera-muzesi",
    "eventSeries": "Bütün O Sanat",
    "link": "https://www.peramuzesi.org.tr/film/barton-fink/5838/3558",
    "director": "Coen Biraderler",
    "year": 1991,
    "runtime": 116
  },
  {
    "id": "04-01-2026-acilis-gecesi-75",
    "date": "2026-01-04",
    "dateDisplay": "04.01.2026",
    "filmTitle": "Açılış Gecesi",
    "filmTitleEn": "Opening Night",
    "time": "15:00",
    "venue": "Pera Müzesi",
    "venueId": "pera-muzesi",
    "eventSeries": "Bütün O Sanat",
    "link": "https://www.peramuzesi.org.tr/film/acilis-gecesi/5843/3558",
    "director": "John Cassavetes",
    "year": 1977,
    "runtime": 144
  },
  {
    "id": "29-12-2025-eraserhead-76a",
    "date": "2025-12-29",
    "dateDisplay": "29.12.2025",
    "filmTitle": "Eraserhead",
    "filmTitleEn": "Eraserhead",
    "time": "11:30, 15:30, 19:15",
    "venue": "Cine Majestic",
    "venueId": "cine-majestic",
    "link": "https://biletinial.com/tr-tr/sinema/eraserhead-film#",
    "director": "David Lynch",
    "year": 1977,
    "runtime": 89
  },
  {
    "id": "30-12-2025-eraserhead-76b",
    "date": "2025-12-30",
    "dateDisplay": "30.12.2025",
    "filmTitle": "Eraserhead",
    "filmTitleEn": "Eraserhead",
    "time": "11:30, 15:30, 19:15",
    "venue": "Cine Majestic",
    "venueId": "cine-majestic",
    "link": "https://biletinial.com/tr-tr/sinema/eraserhead-film#",
    "director": "David Lynch",
    "year": 1977,
    "runtime": 89
  },
  {
    "id": "31-12-2025-eraserhead-76c",
    "date": "2025-12-31",
    "dateDisplay": "31.12.2025",
    "filmTitle": "Eraserhead",
    "filmTitleEn": "Eraserhead",
    "time": "11:30, 15:30, 19:15",
    "venue": "Cine Majestic",
    "venueId": "cine-majestic",
    "link": "https://biletinial.com/tr-tr/sinema/eraserhead-film#",
    "director": "David Lynch",
    "year": 1977,
    "runtime": 89
  },
  {
    "id": "01-01-2026-eraserhead-76d",
    "date": "2026-01-01",
    "dateDisplay": "01.01.2026",
    "filmTitle": "Eraserhead",
    "filmTitleEn": "Eraserhead",
    "time": "11:30, 15:30, 19:15",
    "venue": "Cine Majestic",
    "venueId": "cine-majestic",
    "link": "https://biletinial.com/tr-tr/sinema/eraserhead-film#",
    "director": "David Lynch",
    "year": 1977,
    "runtime": 89
  },
  {
    "id": "29-12-2025-duvara-karsi-78a",
    "date": "2025-12-29",
    "dateDisplay": "29.12.2025",
    "filmTitle": "Duvara Karşı",
    "filmTitleEn": "Head On",
    "time": "11:30, 21:15",
    "venue": "Cine Majestic",
    "venueId": "cine-majestic",
    "link": "https://biletinial.com/tr-tr/sinema/duvara-karsi#",
    "director": "Fatih Akın",
    "year": 2004,
    "runtime": 121
  },
  {
    "id": "30-12-2025-duvara-karsi-78b",
    "date": "2025-12-30",
    "dateDisplay": "30.12.2025",
    "filmTitle": "Duvara Karşı",
    "filmTitleEn": "Head On",
    "time": "11:30, 21:15",
    "venue": "Cine Majestic",
    "venueId": "cine-majestic",
    "link": "https://biletinial.com/tr-tr/sinema/duvara-karsi#",
    "director": "Fatih Akın",
    "year": 2004,
    "runtime": 121
  },
  {
    "id": "31-12-2025-duvara-karsi-78c",
    "date": "2025-12-31",
    "dateDisplay": "31.12.2025",
    "filmTitle": "Duvara Karşı",
    "filmTitleEn": "Head On",
    "time": "11:30, 21:15",
    "venue": "Cine Majestic",
    "venueId": "cine-majestic",
    "link": "https://biletinial.com/tr-tr/sinema/duvara-karsi#",
    "director": "Fatih Akın",
    "year": 2004,
    "runtime": 121
  },
  {
    "id": "01-01-2026-duvara-karsi-78d",
    "date": "2026-01-01",
    "dateDisplay": "01.01.2026",
    "filmTitle": "Duvara Karşı",
    "filmTitleEn": "Head On",
    "time": "11:30, 21:15",
    "venue": "Cine Majestic",
    "venueId": "cine-majestic",
    "link": "https://biletinial.com/tr-tr/sinema/duvara-karsi#",
    "director": "Fatih Akın",
    "year": 2004,
    "runtime": 121
  },
  {
    "id": "29-12-2025-fil-adam-79a",
    "date": "2025-12-29",
    "dateDisplay": "29.12.2025",
    "filmTitle": "Fil Adam",
    "filmTitleEn": "The Elephant Man",
    "time": "13:15, 17:00, 21:00",
    "venue": "Cine Majestic",
    "venueId": "cine-majestic",
    "link": "https://biletinial.com/tr-tr/sinema/fil-adam-film#",
    "director": "David Lynch",
    "year": 1980,
    "runtime": 124
  },
  {
    "id": "30-12-2025-fil-adam-79b",
    "date": "2025-12-30",
    "dateDisplay": "30.12.2025",
    "filmTitle": "Fil Adam",
    "filmTitleEn": "The Elephant Man",
    "time": "13:15, 17:00, 21:00",
    "venue": "Cine Majestic",
    "venueId": "cine-majestic",
    "link": "https://biletinial.com/tr-tr/sinema/fil-adam-film#",
    "director": "David Lynch",
    "year": 1980,
    "runtime": 124
  },
  {
    "id": "31-12-2025-fil-adam-79c",
    "date": "2025-12-31",
    "dateDisplay": "31.12.2025",
    "filmTitle": "Fil Adam",
    "filmTitleEn": "The Elephant Man",
    "time": "13:15, 17:00, 21:00",
    "venue": "Cine Majestic",
    "venueId": "cine-majestic",
    "link": "https://biletinial.com/tr-tr/sinema/fil-adam-film#",
    "director": "David Lynch",
    "year": 1980,
    "runtime": 124
  },
  {
    "id": "01-01-2026-fil-adam-79d",
    "date": "2026-01-01",
    "dateDisplay": "01.01.2026",
    "filmTitle": "Fil Adam",
    "filmTitleEn": "The Elephant Man",
    "time": "13:15, 17:00, 21:00",
    "venue": "Cine Majestic",
    "venueId": "cine-majestic",
    "link": "https://biletinial.com/tr-tr/sinema/fil-adam-film#",
    "director": "David Lynch",
    "year": 1980,
    "runtime": 124
  },
  {
    "id": "29-12-2025-sil-bastan-80a",
    "date": "2025-12-29",
    "dateDisplay": "29.12.2025",
    "filmTitle": "Sil Baştan",
    "filmTitleEn": "Eternal Sunshine of the Spotless Mind",
    "time": "19:00",
    "venue": "Cine Majestic",
    "venueId": "cine-majestic",
    "link": "https://biletinial.com/tr-tr/sinema/sil-bastan#",
    "director": "Michel Gondry",
    "year": 2004,
    "runtime": 108
  },
  {
    "id": "30-12-2025-sil-bastan-80b",
    "date": "2025-12-30",
    "dateDisplay": "30.12.2025",
    "filmTitle": "Sil Baştan",
    "filmTitleEn": "Eternal Sunshine of the Spotless Mind",
    "time": "19:00",
    "venue": "Cine Majestic",
    "venueId": "cine-majestic",
    "link": "https://biletinial.com/tr-tr/sinema/sil-bastan#",
    "director": "Michel Gondry",
    "year": 2004,
    "runtime": 108
  },
  {
    "id": "31-12-2025-sil-bastan-80c",
    "date": "2025-12-31",
    "dateDisplay": "31.12.2025",
    "filmTitle": "Sil Baştan",
    "filmTitleEn": "Eternal Sunshine of the Spotless Mind",
    "time": "19:00",
    "venue": "Cine Majestic",
    "venueId": "cine-majestic",
    "link": "https://biletinial.com/tr-tr/sinema/sil-bastan#",
    "director": "Michel Gondry",
    "year": 2004,
    "runtime": 108
  },
  {
    "id": "01-01-2026-sil-bastan-80d",
    "date": "2026-01-01",
    "dateDisplay": "01.01.2026",
    "filmTitle": "Sil Baştan",
    "filmTitleEn": "Eternal Sunshine of the Spotless Mind",
    "time": "19:00",
    "venue": "Cine Majestic",
    "venueId": "cine-majestic",
    "link": "https://biletinial.com/tr-tr/sinema/sil-bastan#",
    "director": "Michel Gondry",
    "year": 2004,
    "runtime": 108
  },
  {
    "id": "02-01-2026-ucuz-roman-77",
    "date": "2026-01-02",
    "dateDisplay": "02.01.2026",
    "filmTitle": "Ucuz Roman",
    "filmTitleEn": "Pulp Fiction",
    "time": "17:00",
    "venue": "Atlas 1948",
    "venueId": "atlas-1948",
    "link": "https://www.atlas1948.com/movie/ucuz-roman/",
    "director": "Quentin Tarantino",
    "year": 1994,
    "runtime": 154
  },
  {
    "id": "30-12-2025-protesto-81",
    "date": "2025-12-30",
    "dateDisplay": "30.12.2025",
    "filmTitle": "Protesto",
    "filmTitleEn": "La Haine",
    "time": "17:00",
    "venue": "Atlas 1948",
    "venueId": "atlas-1948",
    "link": "https://biletinial.com/tr-tr/sinema/protesto-la-haine#",
    "director": "Matthieu Kassovitz",
    "year": 1995,
    "runtime": 95
  },
  {
    "id": "02-01-2026-aysel-batakli-82",
    "date": "2026-01-02",
    "dateDisplay": "02.01.2026",
    "filmTitle": "Aysel, Bataklı Damın Kızı",
    "filmTitleEn": "The Girl from the Marsh Croft",
    "time": "20:00",
    "venue": "Sinematek",
    "venueId": "sinematek",
    "eventSeries": "Yeniden: Sinematek Restorasyon",
    "link": "https://sinematek.kadikoy.bel.tr/Program/Detay?slug=aysel-batakli-damin-kizi-the-girl-from-the-marsh-croft-25-09-2025",
    "director": "Muhsin Ertuğrul",
    "year": 1935,
    "runtime": 80
  },
  {
    "id": "03-01-2026-dorian-gray-83",
    "date": "2026-01-03",
    "dateDisplay": "03.01.2026",
    "filmTitle": "Dorian Gray'in Magazin Basınındaki Portresi",
    "filmTitleEn": "The Image of Dorian Gray in the Yellow Press",
    "time": "14:00",
    "venue": "Sinematek",
    "venueId": "sinematek",
    "eventSeries": "Ulrike Ottinger Seçkisi",
    "link": "https://sinematek.kadikoy.bel.tr/Program/Detay?slug=dorian-gray-in-magazin-basinindaki-portresi-the-image-of-dorian-gray-in-the-yellow-press-25-09-2025",
    "director": "Ulrike Ottinger",
    "year": 1984,
    "runtime": 150
  },
  {
    "id": "03-01-2026-sunset-bulvari-84",
    "date": "2026-01-03",
    "dateDisplay": "03.01.2026",
    "filmTitle": "Sunset Bulvarı",
    "filmTitleEn": "Sunset Boulevard",
    "time": "18:30",
    "venue": "Sinematek",
    "venueId": "sinematek",
    "eventSeries": "Il Cinema Ritrovato Seçkisi",
    "link": "https://sinematek.kadikoy.bel.tr/Program/Detay?slug=sunset-bulvari-sunset-blvd-25-09-2025",
    "director": "Billy Wilder",
    "year": 1950,
    "runtime": 110
  },
  {
    "id": "04-01-2026-zama-85",
    "date": "2026-01-04",
    "dateDisplay": "04.01.2026",
    "filmTitle": "Zama",
    "filmTitleEn": "Zama",
    "time": "14:00",
    "venue": "Sinematek",
    "venueId": "sinematek",
    "eventSeries": "Rüya Çıkmazı",
    "link": "https://sinematek.kadikoy.bel.tr/Program/Detay?slug=zama-25-09-2025",
    "director": "Lucrecia Martel",
    "year": 2017,
    "runtime": 115
  },
  {
    "id": "04-01-2026-karanligin-golgesi-86",
    "date": "2026-01-04",
    "dateDisplay": "04.01.2026",
    "filmTitle": "Karanlığın Gölgesi",
    "filmTitleEn": "Don't Look Now",
    "time": "18:30",
    "venue": "Sinematek",
    "venueId": "sinematek",
    "eventSeries": "Rüya Çıkmazı",
    "link": "https://sinematek.kadikoy.bel.tr/Program/Detay?slug=karanligin-golgesi-don-t-look-now-25-09-2025",
    "director": "Nicolas Roeg",
    "year": 1973,
    "runtime": 110
  },
  {
    "id": "32",
    "date": "2026-01-05",
    "filmTitle": "İdea",
    "time": "18:30",
    "venue": "AKM Salonu",
    "venueId": "akm-salonu",
    "eventSeries": "",
    "link": "https://biletinial.com/tr-tr/sinema/idea#",
    "director": "Tayfun Pirselimoğlu",
    "year": 2025,
    "runtime": 93
  },
  {
    "id": "33",
    "date": "2026-01-06",
    "filmTitle": "Göksel Beden",
    "time": "20:00",
    "venue": "Sinematek",
    "venueId": "sinematek",
    "eventSeries": "Alice Rohrwacher Retrospektifi",
    "link": "https://sinematek.kadikoy.bel.tr/Program/Detay?slug=goksel-beden-corpo-celeste-25-09-2025",
    "filmTitleEn": "Heavenly Body",
    "director": "Alice Rohrwacher",
    "year": 2011,
    "runtime": 99,
    "isCereyanSelect": true
  },
  {
    "id": "34",
    "date": "2026-01-06",
    "filmTitle": "Uluslararası Sanatçı Filmleri 2025",
    "time": "14:00",
    "venue": "İstanbul Modern",
    "venueId": "istanbul-modern",
    "eventSeries": "Uluslararası Sanatçı Filmleri 2025",
    "link": "https://www.istanbulmodern.org/etkinlikler/uluslararasi-sanatci-filmleri-2025"
  },
  {
    "id": "35",
    "date": "2026-01-06",
    "filmTitle": "İdea",
    "time": "18:30",
    "venue": "AKM Salonu",
    "venueId": "akm-salonu",
    "eventSeries": "",
    "link": "https://biletinial.com/tr-tr/sinema/idea#",
    "director": "Tayfun Pirselimoğlu",
    "year": 2025,
    "runtime": 93
  },
  {
    "id": "36",
    "date": "2026-01-07",
    "filmTitle": "Dahomey",
    "time": "19:00",
    "venue": "Pera Müzesi",
    "venueId": "pera-muzesi",
    "eventSeries": "Bütün O Sanat",
    "link": "https://www.peramuzesi.org.tr/film/dahomey-/5830/3558",
    "filmTitleEn": "Dahomey",
    "director": "Mati Diop",
    "year": 2024,
    "runtime": 68,
    "isCereyanSelect": true
  },
  {
    "id": "37",
    "date": "2026-01-07",
    "filmTitle": "Oldboy",
    "time": "Farklı Saatler",
    "venue": "Farklı Mekanlar",
    "venueId": "various",
    "eventSeries": "Başka Çarşamba",
    "link": "https://www.baskasinema.com/filmler/oldboy/",
    "filmTitleEn": "Oldboy",
    "director": "Park Chan-wook",
    "year": 2003,
    "runtime": 120
  },
  {
    "id": "38",
    "date": "2026-01-07",
    "filmTitle": "Grev",
    "time": "20:00",
    "venue": "Sinematek",
    "venueId": "sinematek",
    "eventSeries": "Sessiz Perşembe: Sergei Eisentein",
    "link": "https://sinematek.kadikoy.bel.tr/Program/Detay?slug=grev-stachka-25-09-2025",
    "filmTitleEn": "Strike",
    "director": "Sergei Eisenstein",
    "year": 1925,
    "runtime": 82
  },
  {
    "id": "39",
    "date": "2026-01-07",
    "filmTitle": "İdea",
    "time": "18:30",
    "venue": "AKM Salonu",
    "venueId": "akm-salonu",
    "eventSeries": "",
    "link": "https://biletinial.com/tr-tr/sinema/idea#",
    "director": "Tayfun Pirselimoğlu",
    "year": 2025,
    "runtime": 93
  },
  {
    "id": "40",
    "date": "2026-01-08",
    "filmTitle": "Bir ve İki",
    "time": "18:30",
    "venue": "Sinematek",
    "venueId": "sinematek",
    "eventSeries": "Il Cinema Ritrovato",
    "link": "https://sinematek.kadikoy.bel.tr/Program/Detay?slug=bir-ve-iki-yi-yi-25-09-2025",
    "filmTitleEn": "Yi Yi",
    "director": "Edward Yang",
    "year": 2000,
    "runtime": 173
  },
  {
    "id": "41",
    "date": "2026-01-08",
    "filmTitle": "Lost, Lost, Lost",
    "time": "19:00",
    "venue": "Atlas 1948",
    "venueId": "atlas-1948",
    "eventSeries": "Othon Cinema",
    "link": "https://othoncinema.com/2025/12/17/lost-lost-lost-gosterimi/",
    "filmTitleEn": "Lost, Lost, Lost",
    "director": "Jonas Mekas",
    "year": 1976,
    "runtime": 180,
    "isCereyanSelect": true
  },
  {
    "id": "42",
    "date": "2026-01-08",
    "filmTitle": "Genç Karl Marx",
    "time": "Farklı Saatler",
    "venue": "Farklı Mekanlar",
    "venueId": "various",
    "eventSeries": "Unutulmaz Perşembe",
    "link": "https://biletinial.com/tr-tr/sinema/genc-karl-marx#",
    "filmTitleEn": "The Young Karl Marx",
    "director": "Raoul Peck",
    "year": 2017,
    "runtime": 118
  },
  {
    "id": "43",
    "date": "2026-01-08",
    "filmTitle": "Görünür Görünmez: Bir (Oto)Sansür Antolojisi",
    "time": "19:00",
    "venue": "İstanbul Barosu Merkez Binası",
    "venueId": "istanbul-barosu",
    "eventSeries": "Yönetmenlerle söyleşi",
    "link": "https://www.instagram.com/p/DSz_gLvCGxs/",
    "filmTitleEn": "Seen Unseen: An Anthology of (Auto)Censorship",
    "director": "Fırat Yücel, Erhan Örs, Hakan Bozyurt, Can Memiş, Sibil Çekmen, Nadir Sönmez, Serra Akcan, belit sağ",
    "year": 2024,
    "runtime": 66,
    "isCereyanSelect": true
  },
  {
    "id": "44",
    "date": "2026-01-08",
    "filmTitle": "O da Bir Şey Mi?",
    "time": "19:00",
    "venue": "İstanbul Modern",
    "venueId": "istanbul-modern",
    "eventSeries": "Biz de Varız!",
    "link": "https://www.istanbulmodern.org/film/o-da-bir-sey-mi-2025",
    "filmTitleEn": "And the Rest Will Follow",
    "director": "Pelin Esmer",
    "year": 2025,
    "runtime": 115
  },
  {
    "id": "45",
    "date": "2026-01-08",
    "filmTitle": "Erken Kış",
    "time": "17:00",
    "venue": "İstanbul Modern",
    "venueId": "istanbul-modern",
    "eventSeries": "Biz de Varız!",
    "link": "https://www.istanbulmodern.org/film/erken-kis-2024",
    "director": "Özcan Alper",
    "year": 2024,
    "runtime": 91
  },
  {
    "id": "46",
    "date": "2026-01-08",
    "filmTitle": "Ev",
    "time": "13:00",
    "venue": "İstanbul Modern",
    "venueId": "istanbul-modern",
    "eventSeries": "Biz de Varız!",
    "link": "https://www.istanbulmodern.org/film/ev-2025",
    "filmTitleEn": "House",
    "director": "Orhan Eskiköy",
    "year": 2025,
    "runtime": 93
  },
  {
    "id": "47",
    "date": "2026-01-08",
    "filmTitle": "Sahibinden Rahmet",
    "time": "15:00",
    "venue": "İstanbul Modern",
    "venueId": "istanbul-modern",
    "eventSeries": "Biz de Varız!",
    "link": "https://www.istanbulmodern.org/film/sahibinden-rahmet-2025",
    "filmTitleEn": "Grace for Sale",
    "director": "Emre Sert, Gözde Yetişkin",
    "year": 2025,
    "runtime": 99
  },
  {
    "id": "48",
    "date": "2026-01-08",
    "filmTitle": "İdea",
    "time": "18:30",
    "venue": "AKM Salonu",
    "venueId": "akm-salonu",
    "eventSeries": "",
    "link": "https://biletinial.com/tr-tr/sinema/idea#",
    "director": "Tayfun Pirselimoğlu",
    "year": 2025,
    "runtime": 93
  },
  {
    "id": "49",
    "date": "2026-01-09",
    "filmTitle": "Mavi",
    "time": "15:00",
    "venue": "Pera Müzesi",
    "venueId": "pera-muzesi",
    "eventSeries": "Görünmez Bağlar",
    "link": "https://www.peramuzesi.org.tr/film/mavi/5948/3568",
    "filmTitleEn": "Blue",
    "director": "Derek Jarman",
    "year": 1993,
    "runtime": 89,
    "isCereyanSelect": true
  },
  {
    "id": "50",
    "date": "2026-01-09",
    "filmTitle": "Chopin, Chopin!",
    "time": "18:45",
    "venue": "Atlas 1948",
    "venueId": "atlas-1948",
    "eventSeries": "Bir Film: 11!",
    "link": "https://www.birfilm.net/_files/ugd/02edfd_2218e5369e28470f8e8474442df12466.pdf",
    "filmTitleEn": "Chopin, A Sonata In Paris",
    "director": "Michal Kwiecinski",
    "year": 2025,
    "runtime": 133
  },
  {
    "id": "51",
    "date": "2026-01-09",
    "filmTitle": "Chopin, Chopin!",
    "time": "18:45",
    "venue": "Kadıköy Sineması",
    "venueId": "kadikoy-sinemasi",
    "eventSeries": "Bir Film: 11!",
    "link": "https://www.birfilm.net/_files/ugd/02edfd_2218e5369e28470f8e8474442df12466.pdf",
    "filmTitleEn": "Chopin, A Sonata In Paris",
    "director": "Michal Kwiecinski",
    "year": 2025,
    "runtime": 133
  },
  {
    "id": "52",
    "date": "2026-01-09",
    "filmTitle": "Dalga",
    "time": "15:30",
    "venue": "Atlas 1948",
    "venueId": "atlas-1948",
    "eventSeries": "Bir Film: 11!",
    "link": "https://www.birfilm.net/_files/ugd/02edfd_2218e5369e28470f8e8474442df12466.pdf",
    "filmTitleEn": "La Ola",
    "director": "Sebastián Lelio",
    "year": 2025,
    "runtime": 128
  },
  {
    "id": "53",
    "date": "2026-01-09",
    "filmTitle": "Dalga",
    "time": "13:00",
    "venue": "Caddebostan CKM",
    "venueId": "ckm",
    "eventSeries": "Bir Film: 11!",
    "link": "https://www.birfilm.net/_files/ugd/02edfd_2218e5369e28470f8e8474442df12466.pdf",
    "filmTitleEn": "La Ola",
    "director": "Sebastián Lelio",
    "year": 2025,
    "runtime": 128
  },
  {
    "id": "54",
    "date": "2026-01-09",
    "filmTitle": "Dalga",
    "time": "15:30",
    "venue": "Kadıköy Sineması",
    "venueId": "kadikoy-sinemasi",
    "eventSeries": "Bir Film: 11!",
    "link": "https://www.birfilm.net/_files/ugd/02edfd_2218e5369e28470f8e8474442df12466.pdf",
    "filmTitleEn": "La Ola",
    "director": "Sebastián Lelio",
    "year": 2025,
    "runtime": 128
  },
  {
    "id": "55",
    "date": "2026-01-09",
    "filmTitle": "Dalga",
    "time": "13:00",
    "venue": "Torun Center",
    "venueId": "torun-center",
    "eventSeries": "Bir Film: 11!",
    "link": "https://www.birfilm.net/_files/ugd/02edfd_2218e5369e28470f8e8474442df12466.pdf",
    "filmTitleEn": "La Ola",
    "director": "Sebastián Lelio",
    "year": 2025,
    "runtime": 128
  },
  {
    "id": "56",
    "date": "2026-01-09",
    "filmTitle": "Hüzünlü ve Güzel Bir Dünya",
    "time": "18:45",
    "venue": "Caddebostan CKM",
    "venueId": "ckm",
    "eventSeries": "Bir Film: 11!",
    "link": "https://www.birfilm.net/_files/ugd/02edfd_2218e5369e28470f8e8474442df12466.pdf",
    "filmTitleEn": "A Sad And Beautiful World",
    "director": "Cyril Aris",
    "year": 2025,
    "runtime": 110
  },
  {
    "id": "57",
    "date": "2026-01-09",
    "filmTitle": "Hüzünlü ve Güzel Bir Dünya",
    "time": "18:45",
    "venue": "Torun Center",
    "venueId": "torun-center",
    "eventSeries": "Bir Film: 11!",
    "link": "https://www.birfilm.net/_files/ugd/02edfd_2218e5369e28470f8e8474442df12466.pdf",
    "filmTitleEn": "A Sad And Beautiful World",
    "director": "Cyril Aris",
    "year": 2025,
    "runtime": 110
  },
  {
    "id": "58",
    "date": "2026-01-09",
    "filmTitle": "Hüzünlü ve Güzel Bir Dünya",
    "time": "13:00",
    "venue": "Nişantaşı City’s AVM Cinewam",
    "venueId": "various",
    "eventSeries": "Bir Film: 11!",
    "link": "https://www.birfilm.net/_files/ugd/02edfd_2218e5369e28470f8e8474442df12466.pdf",
    "filmTitleEn": "A Sad And Beautiful World",
    "director": "Cyril Aris",
    "year": 2025,
    "runtime": 110
  },
  {
    "id": "59",
    "date": "2026-01-09",
    "filmTitle": "Küçük Amelie",
    "time": "18:45",
    "venue": "Nişantaşı City’s AVM Cinewam",
    "venueId": "various",
    "eventSeries": "Bir Film: 11!",
    "link": "https://www.birfilm.net/_files/ugd/02edfd_2218e5369e28470f8e8474442df12466.pdf",
    "filmTitleEn": "Little Amelie",
    "director": "Liane-Cho Han Jin Kuang, Maïlys Vallade",
    "year": 2025,
    "runtime": 78
  },
  {
    "id": "60",
    "date": "2026-01-09",
    "filmTitle": "Mephisto",
    "time": "15:30",
    "venue": "Caddebostan CKM",
    "venueId": "ckm",
    "eventSeries": "Bir Film: 11!",
    "link": "https://www.birfilm.net/_files/ugd/02edfd_2218e5369e28470f8e8474442df12466.pdf",
    "director": "István Szabó",
    "year": 1981,
    "runtime": 146
  },
  {
    "id": "61",
    "date": "2026-01-09",
    "filmTitle": "Mephisto",
    "time": "15:30",
    "venue": "Torun Center",
    "venueId": "torun-center",
    "eventSeries": "Bir Film: 11!",
    "link": "https://www.birfilm.net/_files/ugd/02edfd_2218e5369e28470f8e8474442df12466.pdf",
    "director": "István Szabó",
    "year": 1981,
    "runtime": 146
  },
  {
    "id": "62",
    "date": "2026-01-09",
    "filmTitle": "Mephisto",
    "time": "21:30",
    "venue": "Nişantaşı City’s AVM Cinewam",
    "venueId": "various",
    "eventSeries": "Bir Film: 11!",
    "link": "https://www.birfilm.net/_files/ugd/02edfd_2218e5369e28470f8e8474442df12466.pdf",
    "director": "István Szabó",
    "year": 1981,
    "runtime": 146
  },
  {
    "id": "63",
    "date": "2026-01-09",
    "filmTitle": "Müthiş Eleanor",
    "time": "21:30",
    "venue": "Caddebostan CKM",
    "venueId": "ckm",
    "eventSeries": "Bir Film: 11!",
    "link": "https://www.birfilm.net/_files/ugd/02edfd_2218e5369e28470f8e8474442df12466.pdf",
    "filmTitleEn": "Eleanor The Great",
    "director": "Scarlett Johansson",
    "year": 2025,
    "runtime": 98
  },
  {
    "id": "64",
    "date": "2026-01-09",
    "filmTitle": "Müthiş Eleanor",
    "time": "21:30",
    "venue": "Torun Center",
    "venueId": "torun-center",
    "eventSeries": "Bir Film: 11!",
    "link": "https://www.birfilm.net/_files/ugd/02edfd_2218e5369e28470f8e8474442df12466.pdf",
    "filmTitleEn": "Eleanor The Great",
    "director": "Scarlett Johansson",
    "year": 2025,
    "runtime": 98
  },
  {
    "id": "65",
    "date": "2026-01-09",
    "filmTitle": "Serseri",
    "time": "13:00",
    "venue": "Atlas 1948",
    "venueId": "atlas-1948",
    "eventSeries": "Bir Film: 11!",
    "link": "https://www.birfilm.net/_files/ugd/02edfd_2218e5369e28470f8e8474442df12466.pdf",
    "filmTitleEn": "Urchin",
    "director": "Harris Dickinson",
    "year": 2025,
    "runtime": 99
  },
  {
    "id": "66",
    "date": "2026-01-09",
    "filmTitle": "Serseri",
    "time": "13:00",
    "venue": "Kadıköy Sineması",
    "venueId": "kadikoy-sinemasi",
    "eventSeries": "Bir Film: 11!",
    "link": "https://www.birfilm.net/_files/ugd/02edfd_2218e5369e28470f8e8474442df12466.pdf",
    "filmTitleEn": "Urchin",
    "director": "Harris Dickinson",
    "year": 2025,
    "runtime": 99
  },
  {
    "id": "67",
    "date": "2026-01-09",
    "filmTitle": "Serseri",
    "time": "15:30",
    "venue": "Nişantaşı City’s AVM Cinewam",
    "venueId": "various",
    "eventSeries": "Bir Film: 11!",
    "link": "https://www.birfilm.net/_files/ugd/02edfd_2218e5369e28470f8e8474442df12466.pdf",
    "filmTitleEn": "Urchin",
    "director": "Harris Dickinson",
    "year": 2025,
    "runtime": 99
  },
  {
    "id": "68",
    "date": "2026-01-09",
    "filmTitle": "Yabancı",
    "time": "21:30",
    "venue": "Atlas 1948",
    "venueId": "atlas-1948",
    "eventSeries": "Bir Film: 11!",
    "link": "https://www.birfilm.net/_files/ugd/02edfd_2218e5369e28470f8e8474442df12466.pdf",
    "filmTitleEn": "The Stranger",
    "director": "François Ozon",
    "year": 2025,
    "runtime": 122
  },
  {
    "id": "69",
    "date": "2026-01-09",
    "filmTitle": "Yabancı",
    "time": "21:30",
    "venue": "Kadıköy Sineması",
    "venueId": "kadikoy-sinemasi",
    "eventSeries": "Bir Film: 11!",
    "link": "https://www.birfilm.net/_files/ugd/02edfd_2218e5369e28470f8e8474442df12466.pdf",
    "director": "François Ozon",
    "year": 2025,
    "runtime": 122
  },
  {
    "id": "70",
    "date": "2026-01-09",
    "filmTitle": "Kraliçe Margot",
    "time": "19:00",
    "venue": "Fransız Kültür",
    "venueId": "fransiz-kultur",
    "eventSeries": "Ocak-Şubat Sinema Programı",
    "link": "https://www.ifturquie.org/etkinlik/sinema-kralice-margot/",
    "filmTitleEn": "Queen Margot",
    "director": "Patrice Chéreau",
    "year": 1994,
    "runtime": 159
  },
  {
    "id": "71",
    "date": "2026-01-09",
    "filmTitle": "Oyun",
    "time": "18:30",
    "venue": "Sinematek",
    "venueId": "sinematek",
    "eventSeries": "Rüya Çıkmazı",
    "link": "https://sinematek.kadikoy.bel.tr/Program/Detay?slug=oyun-the-game-25-09-2025",
    "filmTitleEn": "The Game",
    "director": "David Fincher",
    "year": 1997,
    "runtime": 129
  },
  {
    "id": "72",
    "date": "2026-01-09",
    "filmTitle": "Uluslararası Sanatçı Filmleri 2025",
    "time": "14:00",
    "venue": "İstanbul Modern",
    "venueId": "istanbul-modern",
    "eventSeries": "Uluslararası Sanatçı Filmleri 2025",
    "link": "https://www.istanbulmodern.org/etkinlikler/uluslararasi-sanatci-filmleri-2025"
  },
  {
    "id": "73",
    "date": "2026-01-09",
    "filmTitle": "Dehşetin Gecesi 4: White Zombie, Carnival of Souls, The Last Man on Earth, Night of the Living Dead",
    "time": "23:59",
    "venue": "Torun Center",
    "venueId": "torun-center",
    "eventSeries": "",
    "link": "https://biletinial.com/tr-tr/sinema/dehsetin-gecesi-dort#"
  },
  {
    "id": "74",
    "date": "2026-01-09",
    "filmTitle": "İdea",
    "time": "18:30",
    "venue": "AKM Salonu",
    "venueId": "akm-salonu",
    "eventSeries": "",
    "link": "https://biletinial.com/tr-tr/sinema/idea#",
    "director": "Tayfun Pirselimoğlu",
    "year": 2025,
    "runtime": 93
  },
  {
    "id": "75",
    "date": "2026-01-10",
    "filmTitle": "Gelecek",
    "time": "20:00",
    "venue": "Sinematek",
    "venueId": "sinematek",
    "eventSeries": "Alice Rohrwacher Retrospektifi",
    "link": "https://sinematek.kadikoy.bel.tr/Program/Detay?slug=gelecek-futura-25-09-2025",
    "filmTitleEn": "Futura",
    "director": "Alice Rohrwacher, Francesco Munzi, Pietro Marcello",
    "year": 2021,
    "runtime": 105
  },
  {
    "id": "76",
    "date": "2026-01-10",
    "filmTitle": "Kopma Noktası",
    "time": "18:45",
    "venue": "Atlas 1948",
    "venueId": "atlas-1948",
    "eventSeries": "Bir Film: 11!",
    "link": "https://www.birfilm.net/_files/ugd/02edfd_2218e5369e28470f8e8474442df12466.pdf",
    "filmTitleEn": "Dead Man’s Wire",
    "director": "Gus Van Sant",
    "year": 2025,
    "runtime": 105
  },
  {
    "id": "77",
    "date": "2026-01-10",
    "filmTitle": "Kopma Noktası",
    "time": "18:45",
    "venue": "Kadıköy Sineması",
    "venueId": "kadikoy-sinemasi",
    "eventSeries": "Bir Film: 11!",
    "link": "https://www.birfilm.net/_files/ugd/02edfd_2218e5369e28470f8e8474442df12466.pdf",
    "filmTitleEn": "Dead Man’s Wire",
    "director": "Gus Van Sant",
    "year": 2025,
    "runtime": 105
  },
  {
    "id": "78",
    "date": "2026-01-10",
    "filmTitle": "Ev",
    "time": "13:00",
    "venue": "İstanbul Modern",
    "venueId": "istanbul-modern",
    "eventSeries": "Biz de Varız!",
    "link": "https://www.istanbulmodern.org/film/ev-2025",
    "filmTitleEn": "House",
    "director": "Orhan Eskiköy",
    "year": 2025,
    "runtime": 93,
    "isCereyanSelect": true
  },
  {
    "id": "79",
    "date": "2026-01-10",
    "filmTitle": "Yeni Şafak Solarken",
    "time": "17:00",
    "venue": "İstanbul Modern",
    "venueId": "istanbul-modern",
    "eventSeries": "Biz de Varız!",
    "link": "https://www.istanbulmodern.org/film/yeni-safak-solarken-2024",
    "filmTitleEn": "New Dawn Fades",
    "director": "Gürcan Keltek",
    "year": 2024,
    "runtime": 130,
    "isCereyanSelect": true
  },
  {
    "id": "80",
    "date": "2026-01-10",
    "filmTitle": "Bacaklarım Olsaydı Seni Tekmelerdim",
    "time": "21:30",
    "venue": "Caddebostan CKM",
    "venueId": "ckm",
    "eventSeries": "Bir Film: 11!",
    "link": "https://www.birfilm.net/_files/ugd/02edfd_2218e5369e28470f8e8474442df12466.pdf",
    "filmTitleEn": "If I Had Legs I’d Kick You",
    "director": "Mary Bronstein",
    "year": 2025,
    "runtime": 114
  },
  {
    "id": "81",
    "date": "2026-01-10",
    "filmTitle": "Bacaklarım Olsaydı Seni Tekmelerdim",
    "time": "21:30",
    "venue": "Torun Center",
    "venueId": "torun-center",
    "eventSeries": "Bir Film: 11!",
    "link": "https://www.birfilm.net/_files/ugd/02edfd_2218e5369e28470f8e8474442df12466.pdf",
    "filmTitleEn": "If I Had Legs I’d Kick You",
    "director": "Mary Bronstein",
    "year": 2025,
    "runtime": 114
  },
  {
    "id": "82",
    "date": "2026-01-10",
    "filmTitle": "Bacaklarım Olsaydı Seni Tekmelerdim",
    "time": "18:45",
    "venue": "Nişantaşı City’s AVM Cinewam",
    "venueId": "various",
    "eventSeries": "Bir Film: 11!",
    "link": "https://www.birfilm.net/_files/ugd/02edfd_2218e5369e28470f8e8474442df12466.pdf",
    "filmTitleEn": "If I Had Legs I’d Kick You",
    "director": "Mary Bronstein",
    "year": 2025,
    "runtime": 114
  },
  {
    "id": "83",
    "date": "2026-01-10",
    "filmTitle": "Dalga",
    "time": "13:00",
    "venue": "Nişantaşı City’s AVM Cinewam",
    "venueId": "various",
    "eventSeries": "Bir Film: 11!",
    "link": "https://www.birfilm.net/_files/ugd/02edfd_2218e5369e28470f8e8474442df12466.pdf",
    "filmTitleEn": "La Ola",
    "director": "Sebastián Lelio",
    "year": 2025,
    "runtime": 128
  },
  {
    "id": "84",
    "date": "2026-01-10",
    "filmTitle": "Hüzünlü ve Güzel Bir Dünya",
    "time": "13:00",
    "venue": "Atlas 1948",
    "venueId": "atlas-1948",
    "eventSeries": "Bir Film: 11!",
    "link": "https://www.birfilm.net/_files/ugd/02edfd_2218e5369e28470f8e8474442df12466.pdf",
    "filmTitleEn": "A Sad And Beautiful World",
    "director": "Cyril Aris",
    "year": 2025,
    "runtime": 110
  },
  {
    "id": "85",
    "date": "2026-01-10",
    "filmTitle": "Hüzünlü ve Güzel Bir Dünya",
    "time": "13:00",
    "venue": "Kadıköy Sineması",
    "venueId": "kadikoy-sinemasi",
    "eventSeries": "Bir Film: 11!",
    "link": "https://www.birfilm.net/_files/ugd/02edfd_2218e5369e28470f8e8474442df12466.pdf",
    "filmTitleEn": "A Sad And Beautiful World",
    "director": "Cyril Aris",
    "year": 2025,
    "runtime": 110
  },
  {
    "id": "86",
    "date": "2026-01-10",
    "filmTitle": "Küçük Amelie",
    "time": "13:00",
    "venue": "Caddebostan CKM",
    "venueId": "ckm",
    "eventSeries": "Bir Film: 11!",
    "link": "https://www.birfilm.net/_files/ugd/02edfd_2218e5369e28470f8e8474442df12466.pdf",
    "filmTitleEn": "Little Amelie",
    "director": "Liane-Cho Han Jin Kuang, Maïlys Vallade",
    "year": 2025,
    "runtime": 78
  },
  {
    "id": "87",
    "date": "2026-01-10",
    "filmTitle": "Küçük Amelie",
    "time": "13:00",
    "venue": "Torun Center",
    "venueId": "torun-center",
    "eventSeries": "Bir Film: 11!",
    "link": "https://www.birfilm.net/_files/ugd/02edfd_2218e5369e28470f8e8474442df12466.pdf",
    "filmTitleEn": "Little Amelie",
    "director": "Liane-Cho Han Jin Kuang, Maïlys Vallade",
    "year": 2025,
    "runtime": 78
  },
  {
    "id": "88",
    "date": "2026-01-10",
    "filmTitle": "Mephisto",
    "time": "15:30",
    "venue": "Atlas 1948",
    "venueId": "atlas-1948",
    "eventSeries": "Bir Film: 11!",
    "link": "https://www.birfilm.net/_files/ugd/02edfd_2218e5369e28470f8e8474442df12466.pdf",
    "director": "István Szabó",
    "year": 1981,
    "runtime": 146
  },
  {
    "id": "89",
    "date": "2026-01-10",
    "filmTitle": "Mephisto",
    "time": "15:30",
    "venue": "Kadıköy Sineması",
    "venueId": "kadikoy-sinemasi",
    "eventSeries": "Bir Film: 11!",
    "link": "https://www.birfilm.net/_files/ugd/02edfd_2218e5369e28470f8e8474442df12466.pdf",
    "director": "István Szabó",
    "year": 1981,
    "runtime": 146
  },
  {
    "id": "90",
    "date": "2026-01-10",
    "filmTitle": "Nürnberg",
    "time": "21:30",
    "venue": "Atlas 1948",
    "venueId": "atlas-1948",
    "eventSeries": "Bir Film: 11!",
    "link": "https://www.birfilm.net/_files/ugd/02edfd_2218e5369e28470f8e8474442df12466.pdf",
    "filmTitleEn": "Nuremberg",
    "director": "James Vanderbilt",
    "year": 2025,
    "runtime": 148
  },
  {
    "id": "91",
    "date": "2026-01-10",
    "filmTitle": "Nürnberg",
    "time": "21:30",
    "venue": "Kadıköy Sineması",
    "venueId": "kadikoy-sinemasi",
    "eventSeries": "Bir Film: 11!",
    "link": "https://www.birfilm.net/_files/ugd/02edfd_2218e5369e28470f8e8474442df12466.pdf",
    "filmTitleEn": "Nuremberg",
    "director": "James Vanderbilt",
    "year": 2025,
    "runtime": 148
  },
  {
    "id": "92",
    "date": "2026-01-10",
    "filmTitle": "Nürnberg",
    "time": "15:30",
    "venue": "Nişantaşı City’s AVM Cinewam",
    "venueId": "various",
    "eventSeries": "Bir Film: 11!",
    "link": "https://www.birfilm.net/_files/ugd/02edfd_2218e5369e28470f8e8474442df12466.pdf",
    "filmTitleEn": "Nuremberg",
    "director": "James Vanderbilt",
    "year": 2025,
    "runtime": 148
  },
  {
    "id": "93",
    "date": "2026-01-10",
    "filmTitle": "Serseri",
    "time": "15:30",
    "venue": "Caddebostan CKM",
    "venueId": "ckm",
    "eventSeries": "Bir Film: 11!",
    "link": "https://www.birfilm.net/_files/ugd/02edfd_2218e5369e28470f8e8474442df12466.pdf",
    "filmTitleEn": "Urchin",
    "director": "Harris Dickinson",
    "year": 2025,
    "runtime": 99
  },
  {
    "id": "94",
    "date": "2026-01-10",
    "filmTitle": "Serseri",
    "time": "15:30",
    "venue": "Torun Center",
    "venueId": "torun-center",
    "eventSeries": "Bir Film: 11!",
    "link": "https://www.birfilm.net/_files/ugd/02edfd_2218e5369e28470f8e8474442df12466.pdf",
    "filmTitleEn": "Urchin",
    "director": "Harris Dickinson",
    "year": 2025,
    "runtime": 99
  },
  {
    "id": "95",
    "date": "2026-01-10",
    "filmTitle": "Yabancı",
    "time": "18:45",
    "venue": "Caddebostan CKM",
    "venueId": "ckm",
    "eventSeries": "Bir Film: 11!",
    "link": "https://www.birfilm.net/_files/ugd/02edfd_2218e5369e28470f8e8474442df12466.pdf",
    "director": "François Ozon",
    "year": 2025,
    "runtime": 122
  },
  {
    "id": "96",
    "date": "2026-01-10",
    "filmTitle": "Yabancı",
    "time": "18:45",
    "venue": "Torun Center",
    "venueId": "torun-center",
    "eventSeries": "Bir Film: 11!",
    "link": "https://www.birfilm.net/_files/ugd/02edfd_2218e5369e28470f8e8474442df12466.pdf",
    "director": "François Ozon",
    "year": 2025,
    "runtime": 122
  },
  {
    "id": "97",
    "date": "2026-01-10",
    "filmTitle": "Yabancı",
    "time": "21:30",
    "venue": "Nişantaşı City’s AVM Cinewam",
    "venueId": "various",
    "eventSeries": "Bir Film: 11!",
    "link": "https://www.birfilm.net/_files/ugd/02edfd_2218e5369e28470f8e8474442df12466.pdf",
    "director": "François Ozon",
    "year": 2025,
    "runtime": 122
  },
  {
    "id": "98",
    "date": "2026-01-10",
    "filmTitle": "Sahibinden Rahmet",
    "time": "15:00",
    "venue": "İstanbul Modern",
    "venueId": "istanbul-modern",
    "eventSeries": "Biz de Varız!",
    "link": "https://www.istanbulmodern.org/film/sahibinden-rahmet-2025",
    "filmTitleEn": "Grace for Sale",
    "director": "Emre Sert, Gözde Yetişkin",
    "year": 2025,
    "runtime": 99
  },
  {
    "id": "99",
    "date": "2026-01-10",
    "filmTitle": "Rio, Kuzey Bölgesi",
    "time": "15:00",
    "venue": "Pera Müzesi",
    "venueId": "pera-muzesi",
    "eventSeries": "Bütün O Sanat",
    "link": "https://www.peramuzesi.org.tr/film/rio-kuzey-bolgesi/5842/3558",
    "filmTitleEn": "Rio, Zona Norte",
    "director": "Nelson Pereira dos Santos",
    "year": 1957,
    "runtime": 83
  },
  {
    "id": "100",
    "date": "2026-01-10",
    "filmTitle": "Alfa",
    "time": "19:00",
    "venue": "Fransız Kültür",
    "venueId": "fransiz-kultur",
    "eventSeries": "Ocak-Şubat Sinema Programı",
    "link": "https://www.ifturquie.org/etkinlik/sinema-alfa/",
    "filmTitleEn": "Alpha",
    "director": "Julia Ducournau",
    "year": 2025,
    "runtime": 122
  },
  {
    "id": "101",
    "date": "2026-01-10",
    "filmTitle": "Àma Gloria",
    "time": "16:00",
    "venue": "Fransız Kültür",
    "venueId": "fransiz-kultur",
    "eventSeries": "Ocak-Şubat Sinema Programı",
    "link": "https://www.ifturquie.org/etkinlik/sinema-ama-gloria/",
    "filmTitleEn": "Àma Gloria",
    "director": "Marie Amachoukel",
    "year": 2023,
    "runtime": 122
  },
  {
    "id": "102",
    "date": "2026-01-10",
    "filmTitle": "Moğolistanlı Jean D'Arc",
    "time": "18:30",
    "venue": "Sinematek",
    "venueId": "sinematek",
    "eventSeries": "Ulrike Ottinger Seçkisi",
    "link": "https://sinematek.kadikoy.bel.tr/Program/Detay?slug=kayip-otoban-lost-highway-25-09-2025",
    "filmTitleEn": "Johanna D'Arc of Mongolia",
    "director": "Ulrike Ottinger",
    "year": 1989,
    "runtime": 165
  },
  {
    "id": "103",
    "date": "2026-01-10",
    "filmTitle": "İdea",
    "time": "18:30",
    "venue": "AKM Salonu",
    "venueId": "akm-salonu",
    "eventSeries": "",
    "link": "https://biletinial.com/tr-tr/sinema/idea#",
    "director": "Tayfun Pirselimoğlu",
    "year": 2025,
    "runtime": 93
  },
  {
    "id": "104",
    "date": "2026-01-10",
    "filmTitle": "Tolga Karaçelik Söyleşisi ve Film Gecesi",
    "time": "20:00",
    "venue": "Torun Center",
    "venueId": "torun-center",
    "eventSeries": "",
    "link": "https://biletinial.com/tr-tr/sinema/tolga-karacelik-soylesisi-ve-film-gecesi#",
    "director": "Tolga Karaçelik"
  },
  {
    "id": "105",
    "date": "2026-01-10",
    "filmTitle": "Kendal'a bir Heykel",
    "time": "19:00",
    "venue": "Bonkör Büyükada",
    "venueId": "bonkor-buyukada",
    "eventSeries": "",
    "link": "https://www.instagram.com/p/DTF26erCDwj/",
    "director": "Ali Urgancı",
    "year": 2025,
    "runtime": 51
  },
  {
    "id": "106",
    "date": "2026-01-11",
    "filmTitle": "Kopma Noktası",
    "time": "18:45",
    "venue": "Caddebostan CKM",
    "venueId": "ckm",
    "eventSeries": "Bir Film: 11!",
    "link": "https://www.birfilm.net/_files/ugd/02edfd_2218e5369e28470f8e8474442df12466.pdf",
    "filmTitleEn": "Dead Man’s Wire",
    "director": "Gus Van Sant",
    "year": 2025,
    "runtime": 105
  },
  {
    "id": "107",
    "date": "2026-01-11",
    "filmTitle": "Kim Mihri",
    "time": "15:00",
    "venue": "Pera Müzesi",
    "venueId": "pera-muzesi",
    "eventSeries": "Bütün O Sanat",
    "link": "https://www.peramuzesi.org.tr/film/kim-mihri-/5829/3558",
    "filmTitleEn": "Who is Mihri",
    "director": "Berna Gençalp",
    "year": 2022,
    "runtime": 89,
    "isCereyanSelect": true
  },
  {
    "id": "108",
    "date": "2026-01-11",
    "filmTitle": "Uzun Günün Sonu",
    "time": "13:00",
    "venue": "Pera Müzesi",
    "venueId": "pera-muzesi",
    "eventSeries": "Görünmez Bağlar",
    "link": "https://www.peramuzesi.org.tr/film/uzun-gunun-sonu/5950/3568",
    "filmTitleEn": "The Long Day Closes",
    "director": "Terrence Davies",
    "year": 1992,
    "runtime": 85,
    "isCereyanSelect": true
  },
  {
    "id": "109",
    "date": "2026-01-11",
    "filmTitle": "O da Bir Şey Mi?",
    "time": "15:00",
    "venue": "İstanbul Modern",
    "venueId": "istanbul-modern",
    "eventSeries": "Biz de Varız!",
    "link": "https://www.istanbulmodern.org/film/o-da-bir-sey-mi-2025",
    "filmTitleEn": "And the Rest Will Follow",
    "director": "Pelin Esmer",
    "year": 2025,
    "runtime": 115
  },
  {
    "id": "110",
    "date": "2026-01-11",
    "filmTitle": "Bacaklarım Olsaydı Seni Tekmelerdim",
    "time": "15:30",
    "venue": "Atlas 1948",
    "venueId": "atlas-1948",
    "eventSeries": "Bir Film: 11!",
    "link": "https://www.birfilm.net/_files/ugd/02edfd_2218e5369e28470f8e8474442df12466.pdf",
    "filmTitleEn": "If I Had Legs I’d Kick You",
    "director": "Mary Bronstein",
    "year": 2025,
    "runtime": 114
  },
  {
    "id": "111",
    "date": "2026-01-11",
    "filmTitle": "Bacaklarım Olsaydı Seni Tekmelerdim",
    "time": "15:30",
    "venue": "Kadıköy Sineması",
    "venueId": "kadikoy-sinemasi",
    "eventSeries": "Bir Film: 11!",
    "link": "https://www.birfilm.net/_files/ugd/02edfd_2218e5369e28470f8e8474442df12466.pdf",
    "filmTitleEn": "If I Had Legs I’d Kick You",
    "director": "Mary Bronstein",
    "year": 2025,
    "runtime": 114
  },
  {
    "id": "112",
    "date": "2026-01-11",
    "filmTitle": "Chopin, Chopin!",
    "time": "21:30",
    "venue": "Caddebostan CKM",
    "venueId": "ckm",
    "eventSeries": "Bir Film: 11!",
    "link": "https://www.birfilm.net/_files/ugd/02edfd_2218e5369e28470f8e8474442df12466.pdf",
    "filmTitleEn": "Chopin, A Sonata In Paris",
    "director": "Michal Kwiecinski",
    "year": 2025,
    "runtime": 133
  },
  {
    "id": "113",
    "date": "2026-01-11",
    "filmTitle": "Chopin, Chopin!",
    "time": "21:30",
    "venue": "Torun Center",
    "venueId": "torun-center",
    "eventSeries": "Bir Film: 11!",
    "link": "https://www.birfilm.net/_files/ugd/02edfd_2218e5369e28470f8e8474442df12466.pdf",
    "filmTitleEn": "Chopin, A Sonata In Paris",
    "director": "Michal Kwiecinski",
    "year": 2025,
    "runtime": 133
  },
  {
    "id": "114",
    "date": "2026-01-11",
    "filmTitle": "Chopin, Chopin!",
    "time": "15:30",
    "venue": "Nişantaşı City’s AVM Cinewam",
    "venueId": "various",
    "eventSeries": "Bir Film: 11!",
    "link": "https://www.birfilm.net/_files/ugd/02edfd_2218e5369e28470f8e8474442df12466.pdf",
    "filmTitleEn": "Chopin, A Sonata In Paris",
    "director": "Michal Kwiecinski",
    "year": 2025,
    "runtime": 133
  },
  {
    "id": "115",
    "date": "2026-01-11",
    "filmTitle": "Dalga",
    "time": "13:00",
    "venue": "Caddebostan CKM",
    "venueId": "ckm",
    "eventSeries": "Bir Film: 11!",
    "link": "https://www.birfilm.net/_files/ugd/02edfd_2218e5369e28470f8e8474442df12466.pdf",
    "filmTitleEn": "La Ola",
    "director": "Sebastián Lelio",
    "year": 2025,
    "runtime": 128
  },
  {
    "id": "116",
    "date": "2026-01-11",
    "filmTitle": "Dalga",
    "time": "13:00",
    "venue": "Torun Center",
    "venueId": "torun-center",
    "eventSeries": "Bir Film: 11!",
    "link": "https://www.birfilm.net/_files/ugd/02edfd_2218e5369e28470f8e8474442df12466.pdf",
    "filmTitleEn": "La Ola",
    "director": "Sebastián Lelio",
    "year": 2025,
    "runtime": 128
  },
  {
    "id": "117",
    "date": "2026-01-11",
    "filmTitle": "Hüzünlü ve Güzel Bir Dünya",
    "time": "18:45",
    "venue": "Nişantaşı City’s AVM Cinewam",
    "venueId": "various",
    "eventSeries": "Bir Film: 11!",
    "link": "https://www.birfilm.net/_files/ugd/02edfd_2218e5369e28470f8e8474442df12466.pdf",
    "filmTitleEn": "A Sad And Beautiful World",
    "director": "Cyril Aris",
    "year": 2025,
    "runtime": 110
  },
  {
    "id": "118",
    "date": "2026-01-11",
    "filmTitle": "Kopma Noktası",
    "time": "18:45",
    "venue": "Torun Center",
    "venueId": "torun-center",
    "eventSeries": "Bir Film: 11!",
    "link": "https://www.birfilm.net/_files/ugd/02edfd_2218e5369e28470f8e8474442df12466.pdf",
    "filmTitleEn": "Dead Man’s Wire",
    "director": "Gus Van Sant",
    "year": 2025,
    "runtime": 105
  },
  {
    "id": "119",
    "date": "2026-01-11",
    "filmTitle": "Kopma Noktası",
    "time": "21:30",
    "venue": "Nişantaşı City’s AVM Cinewam",
    "venueId": "various",
    "eventSeries": "Bir Film: 11!",
    "link": "https://www.birfilm.net/_files/ugd/02edfd_2218e5369e28470f8e8474442df12466.pdf",
    "filmTitleEn": "Dead Man’s Wire",
    "director": "Gus Van Sant",
    "year": 2025,
    "runtime": 105
  },
  {
    "id": "120",
    "date": "2026-01-11",
    "filmTitle": "Küçük Amelie",
    "time": "13:00",
    "venue": "Atlas 1948",
    "venueId": "atlas-1948",
    "eventSeries": "Bir Film: 11!",
    "link": "https://www.birfilm.net/_files/ugd/02edfd_2218e5369e28470f8e8474442df12466.pdf",
    "filmTitleEn": "Little Amelie",
    "director": "Liane-Cho Han Jin Kuang, Maïlys Vallade",
    "year": 2025,
    "runtime": 78
  },
  {
    "id": "121",
    "date": "2026-01-11",
    "filmTitle": "Küçük Amelie",
    "time": "13:00",
    "venue": "Kadıköy Sineması",
    "venueId": "kadikoy-sinemasi",
    "eventSeries": "Bir Film: 11!",
    "link": "https://www.birfilm.net/_files/ugd/02edfd_2218e5369e28470f8e8474442df12466.pdf",
    "filmTitleEn": "Little Amelie",
    "director": "Liane-Cho Han Jin Kuang, Maïlys Vallade",
    "year": 2025,
    "runtime": 78
  },
  {
    "id": "122",
    "date": "2026-01-11",
    "filmTitle": "Müthiş Eleanor",
    "time": "18:45",
    "venue": "Atlas 1948",
    "venueId": "atlas-1948",
    "eventSeries": "Bir Film: 11!",
    "link": "https://www.birfilm.net/_files/ugd/02edfd_2218e5369e28470f8e8474442df12466.pdf",
    "filmTitleEn": "Eleanor The Great",
    "director": "Scarlett Johansson",
    "year": 2025,
    "runtime": 98
  },
  {
    "id": "123",
    "date": "2026-01-11",
    "filmTitle": "Müthiş Eleanor",
    "time": "18:45",
    "venue": "Kadıköy Sineması",
    "venueId": "kadikoy-sinemasi",
    "eventSeries": "Bir Film: 11!",
    "link": "https://www.birfilm.net/_files/ugd/02edfd_2218e5369e28470f8e8474442df12466.pdf",
    "filmTitleEn": "Eleanor The Great",
    "director": "Scarlett Johansson",
    "year": 2025,
    "runtime": 98
  },
  {
    "id": "124",
    "date": "2026-01-11",
    "filmTitle": "Müthiş Eleanor",
    "time": "13:00",
    "venue": "Nişantaşı City’s AVM Cinewam",
    "venueId": "various",
    "eventSeries": "Bir Film: 11!",
    "link": "https://www.birfilm.net/_files/ugd/02edfd_2218e5369e28470f8e8474442df12466.pdf",
    "filmTitleEn": "Eleanor The Great",
    "director": "Scarlett Johansson",
    "year": 2025,
    "runtime": 98
  },
  {
    "id": "125",
    "date": "2026-01-11",
    "filmTitle": "Nürnberg",
    "time": "15:30",
    "venue": "Caddebostan CKM",
    "venueId": "ckm",
    "eventSeries": "Bir Film: 11!",
    "link": "https://www.birfilm.net/_files/ugd/02edfd_2218e5369e28470f8e8474442df12466.pdf",
    "filmTitleEn": "Nuremberg",
    "director": "James Vanderbilt",
    "year": 2025,
    "runtime": 148
  },
  {
    "id": "126",
    "date": "2026-01-11",
    "filmTitle": "Nürnberg",
    "time": "15:30",
    "venue": "Torun Center",
    "venueId": "torun-center",
    "eventSeries": "Bir Film: 11!",
    "link": "https://www.birfilm.net/_files/ugd/02edfd_2218e5369e28470f8e8474442df12466.pdf",
    "filmTitleEn": "Nuremberg",
    "director": "James Vanderbilt",
    "year": 2025,
    "runtime": 148
  },
  {
    "id": "127",
    "date": "2026-01-11",
    "filmTitle": "Serseri",
    "time": "21:30",
    "venue": "Atlas 1948",
    "venueId": "atlas-1948",
    "eventSeries": "Bir Film: 11!",
    "link": "https://www.birfilm.net/_files/ugd/02edfd_2218e5369e28470f8e8474442df12466.pdf",
    "filmTitleEn": "Urchin",
    "director": "Harris Dickinson",
    "year": 2025,
    "runtime": 99
  },
  {
    "id": "128",
    "date": "2026-01-11",
    "filmTitle": "Serseri",
    "time": "21:30",
    "venue": "Kadıköy Sineması",
    "venueId": "kadikoy-sinemasi",
    "eventSeries": "Bir Film: 11!",
    "link": "https://www.birfilm.net/_files/ugd/02edfd_2218e5369e28470f8e8474442df12466.pdf",
    "filmTitleEn": "Urchin",
    "director": "Harris Dickinson",
    "year": 2025,
    "runtime": 99
  },
  {
    "id": "129",
    "date": "2026-01-11",
    "filmTitle": "Cinema Jazireh",
    "time": "17:00",
    "venue": "İstanbul Modern",
    "venueId": "istanbul-modern",
    "eventSeries": "Biz de Varız!",
    "link": "https://www.istanbulmodern.org/film/cinema-jazireh-2025",
    "filmTitleEn": "Cinema Jazireh",
    "director": "Gözde Kural",
    "year": 2025,
    "runtime": 128
  },
  {
    "id": "130",
    "date": "2026-01-11",
    "filmTitle": "Erken Kış",
    "time": "13:00",
    "venue": "İstanbul Modern",
    "venueId": "istanbul-modern",
    "eventSeries": "Biz de Varız!",
    "link": "https://www.istanbulmodern.org/film/erken-kis-2024",
    "director": "Özcan Alper",
    "year": 2024,
    "runtime": 91
  },
  {
    "id": "131",
    "date": "2026-01-11",
    "filmTitle": "Şeytan Çıkmazı",
    "time": "18:30",
    "venue": "Sinematek",
    "venueId": "sinematek",
    "eventSeries": "Rüya Çıkmazı",
    "link": "https://sinematek.kadikoy.bel.tr/Program/Detay?slug=seytan-cikmazi-angel-heart-25-09-2025",
    "filmTitleEn": "Angel Heart",
    "director": "Alan Parker",
    "year": 1987,
    "runtime": 113
  },
  {
    "id": "132",
    "date": "2026-01-11",
    "filmTitle": "Paris Caligrammes",
    "time": "20:00",
    "venue": "Sinematek",
    "venueId": "sinematek",
    "eventSeries": "Ulrike Ottinger Seçkisi",
    "link": "https://sinematek.kadikoy.bel.tr/Program/Detay?slug=paris-calligrammes-10-10-2025",
    "filmTitleEn": "Paris Caligrammes",
    "director": "Ulrike Ottinger",
    "year": 2020,
    "runtime": 129
  },
  {
    "id": "133",
    "date": "2026-01-11",
    "filmTitle": "İdea",
    "time": "18:30",
    "venue": "AKM Salonu",
    "venueId": "akm-salonu",
    "eventSeries": "",
    "link": "https://biletinial.com/tr-tr/sinema/idea#",
    "director": "Tayfun Pirselimoğlu",
    "year": 2025,
    "runtime": 93
  },
  {
    "id": "134",
    "date": "2026-01-13",
    "filmTitle": "Eflatun",
    "time": "19:00",
    "venue": "Atlas 1948",
    "venueId": "atlas-1948",
    "eventSeries": "Yönetmenin Katılmıyla...",
    "link": "https://biletinial.com/tr-tr/etkinlik/eflatun-film-gosterimi#",
    "filmTitleEn": "Eflatun",
    "director": "Cüneyt Karakuş",
    "year": 2022,
    "runtime": 103
  },
  {
    "id": "135",
    "date": "2026-01-16",
    "filmTitle": "The Godfather",
    "time": "19:30",
    "venue": "Atlas 1948",
    "venueId": "atlas-1948",
    "eventSeries": "",
    "link": "https://biletinial.com/tr-tr/sinema/baba-the-godfather#",
    "filmTitleEn": "Baba",
    "director": "Francis Ford Coppola",
    "year": 1972,
    "runtime": 175
  },
  {
    "id": "136",
    "date": "2026-01-16",
    "filmTitle": "Mulholland Çıkmazı",
    "time": "21:00",
    "venue": "Atlas 1948",
    "venueId": "atlas-1948",
    "eventSeries": "",
    "link": "https://biletinial.com/tr-tr/sinema/mulholland-cikmazi#",
    "filmTitleEn": "Mulholland Drive",
    "director": "David Lynch",
    "year": 2001,
    "runtime": 147
  },
  {
    "id": "137",
    "date": "2026-01-17",
    "filmTitle": "The Godfather Part II",
    "time": "19:30",
    "venue": "Atlas 1948",
    "venueId": "atlas-1948",
    "eventSeries": "",
    "link": "https://biletinial.com/tr-tr/sinema/baba-2#",
    "filmTitleEn": "Baba 2",
    "director": "Francis Ford Coppola",
    "year": 1974,
    "runtime": 202
  },
  {
    "id": "138",
    "date": "2026-01-18",
    "filmTitle": "Issız Adam",
    "time": "13:00",
    "venue": "Atlas 1948",
    "venueId": "atlas-1948",
    "eventSeries": "Film Gösterimi ve Rota Yürüyüşü",
    "link": "https://biletinial.com/tr-tr/etkinlik/issiz-adam-film-gosterimi-sine-masal-rota-yuruyusu#",
    "filmTitleEn": "Alone",
    "director": "Çağan Irmak",
    "year": 2008,
    "runtime": 113,
    "isCereyanSelect": true
  },
  {
    "id": "139",
    "date": "2026-01-18",
    "filmTitle": "Kayıp Otoban",
    "time": "17:00",
    "venue": "Atlas 1948",
    "venueId": "atlas-1948",
    "eventSeries": "",
    "link": "https://biletinial.com/tr-tr/sinema/kayip-otoban#",
    "filmTitleEn": "Lost Highway",
    "director": "David Lynch",
    "year": 1997,
    "runtime": 135
  },
  {
    "id": "140",
    "date": "2026-01-15",
    "filmTitle": "Borgo",
    "time": "19:00",
    "venue": "Beyoğlu Sineması",
    "venueId": "beyoglu-sinemasi",
    "eventSeries": "Ülke Sineması: Fransa",
    "link": "https://www.instagram.com/stories/highlights/18087464447045450/?hl=fr",
    "filmTitleEn": "Borgo",
    "director": "Stéphane Demoustier",
    "year": 2023,
    "runtime": 117
  },
  {
    "id": "141",
    "date": "2026-01-16",
    "filmTitle": "Sadece Birkaç Gün",
    "time": "19:00",
    "venue": "Beyoğlu Sineması",
    "venueId": "beyoglu-sinemasi",
    "eventSeries": "Ülke Sineması: Fransa",
    "link": "https://www.instagram.com/stories/highlights/18087464447045450/?hl=fr",
    "filmTitleEn": "Just a Couple of Days",
    "director": "Julie Navarro",
    "year": 2024,
    "runtime": 103
  },
  {
    "id": "142",
    "date": "2026-01-17",
    "filmTitle": "Z",
    "time": "15:00",
    "venue": "Beyoğlu Sineması",
    "venueId": "beyoglu-sinemasi",
    "eventSeries": "Ülke Sineması: Fransa",
    "link": "https://www.instagram.com/stories/highlights/18087464447045450/?hl=fr",
    "filmTitleEn": "Z",
    "director": "Costa Gavras",
    "year": 1969,
    "runtime": 127
  },
  {
    "id": "143",
    "date": "2026-01-17",
    "filmTitle": "Making Of",
    "time": "19:00",
    "venue": "Beyoğlu Sineması",
    "venueId": "beyoglu-sinemasi",
    "eventSeries": "Ülke Sineması: Fransa",
    "link": "https://www.instagram.com/stories/highlights/18087464447045450/?hl=fr",
    "filmTitleEn": "Making Of",
    "director": "Cédric Kahn",
    "year": 2012,
    "runtime": 119
  },
  {
    "id": "144",
    "date": "2026-01-14",
    "filmTitle": "Beden ve Ruh",
    "time": "Farklı Saatler",
    "venue": "Farklı Mekanlar",
    "venueId": "various",
    "eventSeries": "Başka Çarşamba",
    "link": "https://www.baskasinema.com/filmler/on-body-and-soul/",
    "filmTitleEn": "On Body and Soul",
    "director": "Ildikó Enyedi",
    "year": 2017,
    "runtime": 116
  },
  {
    "id": "145",
    "date": "2026-01-14",
    "filmTitle": "Dünyanın En Kötü İnsanı",
    "time": "Farklı Saatler",
    "venue": "Farklı Mekanlar",
    "venueId": "various",
    "eventSeries": "Unutulmaz Perşembe",
    "link": "https://biletinial.com/tr-tr/sinema/dunyanin-en-kotu-insani#",
    "filmTitleEn": "The Worst Person in the World",
    "director": "Joachim Trier",
    "year": 2021,
    "runtime": 128
  },
  {
    "id": "146",
    "date": "2026-01-15",
    "filmTitle": "The Straight Story",
    "time": "Farklı Saatler",
    "venue": "Farklı Mekanlar",
    "venueId": "various",
    "eventSeries": "Unutulmaz Perşembe",
    "link": "https://biletinial.com/tr-tr/sinema/straightin-hikayesi#",
    "filmTitleEn": "Straight'in Hikayesi",
    "director": "David Lynch",
    "year": 1999,
    "runtime": 112
  },
  {
    "id": "147",
    "date": "2026-01-16",
    "filmTitle": "Özel Hayat",
    "time": "19:00",
    "venue": "Fransız Kültür",
    "venueId": "fransiz-kultur",
    "eventSeries": "Ocak-Şubat Sinema Programı",
    "link": "https://www.ifturquie.org/etkinlik/sinema-ozel-hayat/",
    "filmTitleEn": "Private life",
    "director": "Rebecca Zlotowski",
    "year": 2025,
    "runtime": 105
  },
  {
    "id": "148",
    "date": "2026-01-17",
    "filmTitle": "Kraliçe Margot",
    "time": "16:00",
    "venue": "Fransız Kültür",
    "venueId": "fransiz-kultur",
    "eventSeries": "Ocak-Şubat Sinema Programı",
    "link": "https://www.ifturquie.org/etkinlik/sinema-kralice-margot/",
    "filmTitleEn": "Queen Margot",
    "director": "Patrice Chéreau",
    "year": 1994,
    "runtime": 159
  },
  {
    "id": "149",
    "date": "2026-01-17",
    "filmTitle": "Àma Gloria",
    "time": "19:00",
    "venue": "Fransız Kültür",
    "venueId": "fransiz-kultur",
    "eventSeries": "Ocak-Şubat Sinema Programı",
    "link": "https://www.ifturquie.org/etkinlik/sinema-ama-gloria/",
    "filmTitleEn": "Àma Gloria",
    "director": "Marie Amachoukel",
    "year": 2023,
    "runtime": 122
  },
  {
    "id": "150",
    "date": "2026-01-15",
    "filmTitle": "Yeni Şafak Solarken",
    "time": "14:30",
    "venue": "İstanbul Modern",
    "venueId": "istanbul-modern",
    "eventSeries": "Biz de Varız!",
    "link": "https://www.istanbulmodern.org/film/yeni-safak-solarken-2024",
    "filmTitleEn": "New Dawn Fades",
    "director": "Gürcan Keltek",
    "year": 2024,
    "runtime": 130
  },
  {
    "id": "151",
    "date": "2026-01-15",
    "filmTitle": "Buradayım, İyiyim",
    "time": "17:00",
    "venue": "İstanbul Modern",
    "venueId": "istanbul-modern",
    "eventSeries": "Biz de Varız!",
    "link": "https://www.istanbulmodern.org/film/buradayim-iyiyim-2025",
    "filmTitleEn": "I'm Here I'm Fine",
    "director": "Emine Emel Balcı",
    "year": 2025,
    "runtime": 100
  },
  {
    "id": "152",
    "date": "2026-01-15",
    "filmTitle": "Gündüz Apollon Gece Athena",
    "time": "19:00",
    "venue": "İstanbul Modern",
    "venueId": "istanbul-modern",
    "eventSeries": "Biz de Varız!",
    "link": "https://www.istanbulmodern.org/film/gunduz-apollon-gece-athena-2024-ct-3982",
    "filmTitleEn": "Apollon By Day Athena By Night",
    "director": "Emine Yıldırım",
    "year": 2024,
    "runtime": 112,
    "isCereyanSelect": true
  },
  {
    "id": "153",
    "date": "2026-01-16",
    "filmTitle": "Uluslararası Sanatçı Filmleri 2025",
    "time": "14:00",
    "venue": "İstanbul Modern",
    "venueId": "istanbul-modern",
    "eventSeries": "Uluslararası Sanatçı Filmleri 2025",
    "link": "https://www.istanbulmodern.org/etkinlikler/uluslararasi-sanatci-filmleri-2025"
  },
  {
    "id": "154",
    "date": "2026-01-17",
    "filmTitle": "Hiçbir Şey Normal Değil",
    "time": "15:00",
    "venue": "İstanbul Modern",
    "venueId": "istanbul-modern",
    "eventSeries": "Biz de Varız!",
    "link": "https://www.istanbulmodern.org/film/hicbir-sey-normal-degil-2024",
    "filmTitleEn": "Strange Abandoned Deranged",
    "director": "Ceylan Özgün Özçelik",
    "year": 2024,
    "runtime": 71
  },
  {
    "id": "155",
    "date": "2026-01-17",
    "filmTitle": "Tavşan İmaparatorluğu",
    "time": "17:00",
    "venue": "İstanbul Modern",
    "venueId": "istanbul-modern",
    "eventSeries": "Biz de Varız!",
    "link": "https://www.istanbulmodern.org/film/tavsan-imparatorlugu-2024",
    "filmTitleEn": "Empire of the Rabbits",
    "director": "Seyfettin Tokmak",
    "year": 2024,
    "runtime": 95
  },
  {
    "id": "156",
    "date": "2026-01-18",
    "filmTitle": "Gündüz Apollon Gece Athena",
    "time": "13:00",
    "venue": "İstanbul Modern",
    "venueId": "istanbul-modern",
    "eventSeries": "Biz de Varız!",
    "link": "https://www.istanbulmodern.org/film/gunduz-apollon-gece-athena-2024-ct-3982",
    "filmTitleEn": "Apollon By Day Athena By Night",
    "director": "Emine Yıldırım",
    "year": 2024,
    "runtime": 112
  },
  {
    "id": "157",
    "date": "2026-01-18",
    "filmTitle": "Buradayım, İyiyim",
    "time": "15:00",
    "venue": "İstanbul Modern",
    "venueId": "istanbul-modern",
    "eventSeries": "Biz de Varız!",
    "link": "https://www.istanbulmodern.org/film/buradayim-iyiyim-2025",
    "filmTitleEn": "I'm Here I'm Fine",
    "director": "Emine Emel Balcı",
    "year": 2025,
    "runtime": 100
  },
  {
    "id": "158",
    "date": "2026-01-18",
    "filmTitle": "Gerçek Ötesi",
    "time": "19:00",
    "venue": "İstanbul Modern",
    "venueId": "istanbul-modern",
    "eventSeries": "Biz de Varız!",
    "link": "https://www.istanbulmodern.org/film/gercek-otesi-2025",
    "filmTitleEn": "Post Truth",
    "director": "Alkan Avcıoğlu",
    "year": 2025,
    "runtime": 102
  },
  {
    "id": "159",
    "date": "2026-01-18",
    "filmTitle": "Vesikalı Yarim",
    "time": "18:30",
    "venue": "Kadıköy Sineması",
    "venueId": "kadikoy-sinemasi",
    "eventSeries": "Belki Sinema",
    "link": "https://www.instagram.com/p/DSu713BjMii/?hl=en",
    "filmTitleEn": "My Prostitute Love",
    "director": "Lütfi Akad",
    "year": 1968,
    "runtime": 89,
    "isCereyanSelect": true
  },
  {
    "id": "160",
    "date": "2026-01-14",
    "filmTitle": "Kanlı Düğün",
    "time": "19:00",
    "venue": "Pera Müzesi",
    "venueId": "pera-muzesi",
    "eventSeries": "Bütün O Sanat",
    "link": "https://www.peramuzesi.org.tr/film/kanli-dugun-/5834/3558",
    "filmTitleEn": "Blood Wedding",
    "director": "Carlos Saura",
    "year": 1981,
    "runtime": 67
  },
  {
    "id": "161",
    "date": "2026-01-16",
    "filmTitle": "Karanlığın Kalbi",
    "time": "19:00",
    "venue": "Pera Müzesi",
    "venueId": "pera-muzesi",
    "eventSeries": "Bütün O Sanat",
    "link": "https://www.peramuzesi.org.tr/film/karanligin-kalbi/5836/3558",
    "filmTitleEn": "Heart of Darkness",
    "director": "Fax Bahr, George Hickenlooper, Eleanor Coppola",
    "year": 1991,
    "runtime": 96
  },
  {
    "id": "162",
    "date": "2026-01-16",
    "filmTitle": "Orlando",
    "time": "20:30",
    "venue": "Pera Müzesi",
    "venueId": "pera-muzesi",
    "eventSeries": "Görünmez Bağlar",
    "link": "https://www.peramuzesi.org.tr/film/orlando/5949/3568",
    "filmTitleEn": "Orlando",
    "director": "Sally Potter",
    "year": 1992,
    "runtime": 94
  },
  {
    "id": "163",
    "date": "2026-01-17",
    "filmTitle": "Çocuklarıma Günce",
    "time": "15:00",
    "venue": "Pera Müzesi",
    "venueId": "pera-muzesi",
    "eventSeries": "Bütün O Sanat",
    "link": "https://www.peramuzesi.org.tr/film/cocuklarima-gunce/5839/3558",
    "filmTitleEn": "Diary for My Children",
    "director": "Márta Mészáros",
    "year": 1984,
    "runtime": 106
  },
  {
    "id": "164",
    "date": "2026-01-17",
    "filmTitle": "Sevgililerime Günce",
    "time": "17:00",
    "venue": "Pera Müzesi",
    "venueId": "pera-muzesi",
    "eventSeries": "Bütün O Sanat",
    "link": "https://www.peramuzesi.org.tr/film/sevgililerime-gunce/5840/3558",
    "filmTitleEn": "Diary for My Lovers",
    "director": "Márta Mészáros",
    "year": 1987,
    "runtime": 141
  },
  {
    "id": "165",
    "date": "2026-01-18",
    "filmTitle": "Anne ve Babama Günce",
    "time": "15:00",
    "venue": "Pera Müzesi",
    "venueId": "pera-muzesi",
    "eventSeries": "Bütün O Sanat",
    "link": "https://www.peramuzesi.org.tr/film/anne-ve-babama-gunce/5841/3558",
    "filmTitleEn": "Diary for My Father and Mother",
    "director": "Márta Mészáros",
    "year": 1990,
    "runtime": 119
  },
  {
    "id": "166",
    "date": "2026-01-13",
    "filmTitle": "Mucizeler",
    "time": "20:00",
    "venue": "Sinematek",
    "venueId": "sinematek",
    "eventSeries": "Alice Rohrwacher Retrospektifi",
    "link": "https://sinematek.kadikoy.bel.tr/Program/Detay?slug=mucizeler-le-meraviglie-25-09-2025",
    "filmTitleEn": "Miracles",
    "director": "Alice Rohrwacher",
    "year": 2014,
    "runtime": 110
  },
  {
    "id": "167",
    "date": "2026-01-14",
    "filmTitle": "Drakula İstanbul'da",
    "time": "20:00",
    "venue": "Sinematek",
    "venueId": "sinematek",
    "eventSeries": "Yeniden: Sinematek Restorasyon",
    "link": "https://sinematek.kadikoy.bel.tr/Program/Detay?slug=drakula-istanbulda-12-11-2025",
    "filmTitleEn": "Dracula in Istanbul",
    "director": "Mehmet Muhtar",
    "year": 1953,
    "runtime": 102,
    "isCereyanSelect": true
  },
  {
    "id": "168",
    "date": "2026-01-15",
    "filmTitle": "Ekim",
    "time": "20:00",
    "venue": "Sinematek",
    "venueId": "sinematek",
    "eventSeries": "Sessiz Perşembe",
    "link": "https://sinematek.kadikoy.bel.tr/Program/Detay?slug=ekim-oktyabr-25-09-2025",
    "filmTitleEn": "October",
    "director": "Sergei Eisenstein",
    "year": 1928,
    "runtime": 95
  },
  {
    "id": "169",
    "date": "2026-01-16",
    "filmTitle": "Gözleri Tamamen Kapalı",
    "time": "20:00",
    "venue": "Sinematek",
    "venueId": "sinematek",
    "eventSeries": "Rüya Çıkmazı",
    "link": "https://sinematek.kadikoy.bel.tr/Program/Detay?slug=gozleri-tamamen-kapali-eyes-wide-shut-01-10-2025",
    "filmTitleEn": "Eyes Wide Shut",
